Date,link,text,len,sentiment
2021-01-06 11:54:00+05:30,https://www.moneycontrol.com/news/business/titan-jewellery-division-recovers-from-pandemic-blow-enters-growth-phase-6309521.html,"Image: PTI

Tata group firm Titan on Wednesday said its jewellery division has recovered from the COVID-19 pandemic jolt, entering the growth phase, and other divisions have moved closer to full recovery led by festive season sales in the third quarter of the current fiscal.

The company had reported an unprecedented net loss of Rs 297 crore in the April-June quarter due to the pandemic. Its standalone net profit declined 37.81 percent to Rs 199 crore for the quarter ended September 30, 2020 as against a net profit of Rs 320 crore in the corresponding period of the preceding fiscal.

""The company had been expecting a good festive season given the fact that there were signs that customers wanted to feel good by stepping out and shopping after 6 months of being restricted primarily to their homes.

“Q3 did not disappoint. The jewellery division has crossed the recovery phase to growth phase and other two large divisions have also moved much closer to the full recovery,"" Titan said in its quarterly update.

Titan said the company continues to focus on the creation of a combined digital and physical experience by which the customers can discover, engage, and buy products of their choice through the channel of their preference. Brand websites of Tanishq and Titan Eye Plus have added augmented reality for virtual try-out of certain products by customers.

COVID-19 Vaccine Frequently Asked Questions View more How does a vaccine work? A vaccine works by mimicking a natural infection. A vaccine not only induces immune response to protect people from any future COVID-19 infection, but also helps quickly build herd immunity to put an end to the pandemic. Herd immunity occurs when a sufficient percentage of a population becomes immune to a disease, making the spread of disease from person to person unlikely. The good news is that SARS-CoV-2 virus has been fairly stable, which increases the viability of a vaccine. How many types of vaccines are there? There are broadly four types of vaccine — one, a vaccine based on the whole virus (this could be either inactivated, or an attenuated [weakened] virus vaccine); two, a non-replicating viral vector vaccine that uses a benign virus as vector that carries the antigen of SARS-CoV; three, nucleic-acid vaccines that have genetic material like DNA and RNA of antigens like spike protein given to a person, helping human cells decode genetic material and produce the vaccine; and four, protein subunit vaccine wherein the recombinant proteins of SARS-COV-2 along with an adjuvant (booster) is given as a vaccine. What does it take to develop a vaccine of this kind? Vaccine development is a long, complex process. Unlike drugs that are given to people with a diseased, vaccines are given to healthy people and also vulnerable sections such as children, pregnant women and the elderly. So rigorous tests are compulsory. History says that the fastest time it took to develop a vaccine is five years, but it usually takes double or sometimes triple that time. View more Show

Titan said its arm Titan Commodity Trading has received approval of admission of membership as a trading member (stock broker) on Multi Commodity Exchange of India (MCX) along with SEBI approval for the same.

""The company is setting up its processes and is expected to commence its activities in the very near future,"" the company said.

Elaborating on jewellery business, Titan said: ""The jewellery industry saw a resurgence in the festive season along with a pent up demand for wedding jewellery as most of the weddings in the first half of year 2020-21 were deferred.

“The company already announced the 15 percent growth in the 30-day festive period from Dussehra to Diwali. Fortunately, the growth trend was visible even after the festive season ended and the division has recorded close to 15 percent growth (excluding sale of raw gold of Rs 334 crore) in Q3.”

Titan said, while ticket size continues to be higher due to higher gold rates and higher share of wedding related products, 100 percent recovery in buyers (number of invoices) is yet to be seen.

Titan's watches and wearables division had a recovery rate of around 88 percent in Q3, compared to the revenue of the same quarter in last year.

""The e-commerce channel is leading the recovery with very strong absolute growth of over 30 percent. The festive period saw a surge in footfall in the shopping zones and the recovery rate improved in metros in Q3.”

The recovery rate for all the retail channels had been steadily increasing month-on-month primarily due to higher consumer walk-ins and also complemented by the selling of multiple products/ higher ticket size product in a single invoice, it said.

Titan said its other businesses had a revenue recovery of around 80 percent, compared to the revenue of the same quarter in last year.

The company’s eyeware division had a recovery of 92 percent in Q3, compared to the revenue of the same quarter in last year.

The recovery rate for fragrances and accessories continued to be muted due to the slow recovery of two of the biggest channels, trade and large format stores (LFS), the company added.

Titan said Caratlane, which is 72.3 percent owned by the company, delivered a growth of 39 percent for the quarter and the growth turned positive on a cumulative basis for the year.",893,0.6918273329734802
2020-11-19 12:27:00+05:30,https://www.moneycontrol.com/news/business/normalcy-returning-watches-and-eyewear-business-catching-up-says-titan-cfo-s-subramaniam-6135921.html,"Titan Company

S Subramaniam, CFO of Titan said sales were returning to normalcy and that the company logged 15 percent growth in sales this festive season versus last festive season.

“We will grow in the jewellery business in Q3. Watches and eyewear business catching up, gold coin sales are returning to normalcy,” he said in an interview to CNBC-TV18.

According to him, sales in tier-III and IV cities too were strong. “We saw an uptick in demand during festive season in tier-I and II cities too,” added Subramaniam.

Watch full video here

Source: CNBC-TV18",94,0.9999463558197021
2020-11-04 16:46:00+05:30,https://www.moneycontrol.com/news/business/stocks/reduce-titan-target-of-rs-1050-hdfc-securities-6066041.html,"HDFC Securities' research report on Titan

Titan’s demand recovery has been reasonable (especially in Jewellery). That said, Titan’s relative market share among the big-box jewellers seems to have hit a pit stop. Channel checks suggest big-box jewellers have declined 0 to - 15% vs Titan’s (jewellery business) -15% (adj. bullion sale and ineffective hedges). While optically the reported Jewellery margins remain weak at 7% (HSIE: 6.3%), the underlying Jewellery EBIT margin at 10%+ remains healthy. Non-jewellery recovering progressively with improving profitability but isn’t a needle mover.

Outlook

We mostly maintain our FY22/23 EPS estimates and our DCFbased target price of Rs 1,050/sh (implying 50x Sep-22 P/E).

For all recommendations report, click here

Disclaimer: The views and investment tips expressed by investment experts/broking houses/rating agencies on moneycontrol.com are their own, and not that of the website or its management. Moneycontrol.com advises users to check with certified experts before taking any investment decisions.

Read More",153,0.9803299605846405
2020-11-03 13:39:00+05:30,https://www.moneycontrol.com/news/business/stocks/buy-titan-target-of-rs-1428-dolat-capital-market-6052761.html,"live bse live

nse live Volume Todays L/H More ×

Dolat Capital Market's research report on Titan

Titan’s Q2FY21 revenue and APAT was in line, but EBITDA was lower than our estimates. Significant jump in gold prices impacted sales in July, however, August and September witnessed gradual recovery, helping the jewellery segment to recover 89% of its sales. Other expenses remained high due to increase in ineffective hedges. Going ahead, ineffective hedges are likely to reduce substantially with normalization of demand scenario.

Outlook

We have maintained our FY21E at Rs 12.3 and revised FY22E EPS estimates at Rs 25.2. We have introduced FY23E EPS at Rs 29.8. We maintain Buy, with TP of Rs 1,428 (48x FY23E).

For all recommendations report, click here

Disclaimer: The views and investment tips expressed by investment experts/broking houses/rating agencies on moneycontrol.com are their own, and not that of the website or its management. Moneycontrol.com advises users to check with certified experts before taking any investment decisions.

Read More",164,0.4341352581977844
2020-10-29 14:57:00+05:30,https://www.moneycontrol.com/news/business/stocks/what-should-investors-do-with-titan-post-q2-numbers-buy-sell-or-hold-6031491.html,"live bse live

nse live Volume Todays L/H More ×

Titan Company share price shed 4 percent in the early trade on October 29 after the company posted its September quarter earnings.

It has reported standalone net profit of Rs 199 crore for Q2FY21 against a loss of Rs 270 crore quarter-on-quarter (QoQ) and a profit of Rs 320 crore year-on-year.

The company's standalone revenue came in at Rs 4,318 crore against Rs 1,862 crore QoQ and Rs 4,435 crore YoY.

The standalone EBITDA of the company came at Rs 294 crore against Rs 513 crore YoY. EBITDA margin stood at 6.8 percent against 11.6 percent YoY.

In the quarter ended September 2020, the big bull Rakesh Jhunjhunwala reduced stake in Titan Company after his wife, Rekha, sold 50,000 shares in the September quarter, according to a regulatory filing.

Also Read - Titan reports Q2 standalone profit at Rs 199 crore, meets expectations on revenue, profit front

Here are the brokerages views on the stock:

Credit Suisse

Credit Suisse has maintained neutral call on the stock and raised target to Rs 1,170 from Rs 1,070.

According to research house the recovery is likely to lag heightened expectations. It retain its neutral call & look for a better entry point, reported CNBC-TV18.

CLSA

The company is emerging stronger from the crisis, while valuations already discount positives. Maintain FY21 earnings estimates but upgrade FY22 on higher margin expectations, said CLSA

The risk-reward is unfavourable with PE valuations at 61x FY22e. It has maintained sell rating and target raised to Rs 1,100 from Rs 931, reported CNBC-TV18.

Motilal Oswal

Despite a relatively higher base for 3QFY21, outlook for the quarter remains positive due to (a) bunching up of postponed wedding demand, in addition to traditionally strong demand for wedding jewellery in 3Q, and (b) encouraging festive demand, which has already seen positive growth in the first 10 days of the festive season.

While FY22E multiples at 55x may appear expensive, it is primarily due to temporary impact of the pandemic in FY21, from which the rebound would be sharp over the next couple of years. Maintain Buy with target price of Rs 1,400 (55x Sep'22 EPS).

Sharekhan

Titan posted good recovery in Q2FY2021 with 98% of the business recovering to pre-covid levels. Overall, Sharekhan expect Titan to benefit from people shifting to trusted brands and market share gains. This, along with a relatively stable balance sheet, makes it a better play in the retail space.

Sharekhan has by recommendation on the stock with a revised price target (PT) of Rs 1,350. The stock is currently trading at 50.7x and 42.9x its FY2022/FY2023E EPS (EV/EBIDTA of 32.4x/27.5xits FY2022/FY2023E).

At 09:23 hrs, Titan Company was quoting at Rs 1,172.40, down Rs 44.60, or 3.66 percent on the BSE.",463,0.411634761095047
2020-10-13 10:31:00+05:30,https://www.moneycontrol.com/news/trends/tanishq-takes-down-ekatvam-campaign-advertisement-of-hindu-muslim-couple-after-social-media-backlash-shashi-tharoor-slams-trolls-5955961.html,"Jewellery brand Tanishq has taken down a commercial video showcasing a Muslim family celebrating the baby shower of their Hindu daughter-in-law.

The video, which went viral on social media, sparked controversy with several people alleging that the commercial promotes “love jihad”.

Following the backlash, the 45-second commercial, which was uploaded on YouTube, was made private, making it unavailable for people to view it.

Some people even expressed concerns that the video which ""promotes religious harmony"" was taken down due to the criticism.

Twitter user, Varun Gandhi, said, ""A beautiful ad being taken up in such a distasteful way using #BoycottTanishq campaign. As a society, we need to introspect.""

Thousands of people took to Twitter to criticise and troll the Titan-owned jewellery brand's commercial for showing an inter-faith couple, especially a Hindu daughter-in-law. It eventually led to hashtag #BoycottTanishq trending on Twitter.

The video was part of the brand's campaign to celebrate promote jewellery from 'Ekatvam' collection.

Read: ‘Boycott Tanishq’ trends on Twitter over jewellery brand’s interfaith marriage-themed advertisement

The YouTube description of the commercial read: ""She is married into a family that loves her like their own child. Only for her, they go out of their way to celebrate an occasion that they usually don’t. A beautiful confluence of two different religions, traditions, and cultures.""

Thousands called out the Tanishq commercial on saying it is ""anti-Hindu"".



Please @TanishqJewelry also show an ad where a muslim woman celebrates eid with her hindu in-laws. Also hire few dozen exxtra security guards around your showrooms and offices because that offense generally tends to become deadly. #BoycottTanishq https://t.co/ImACJ3mFEs

— Maddy (@jai_in_) October 12, 2020

#BoycottTanishq

many brands are doing this why, why they want to destroy Hinduism.

Tanishq jewelry is promoting diwali ad in which hindu girl is married to a muslim and got pregnant and also showing thathashtag #BoycottTanishq trending on Twitter. muslim are peaceful in religion and promoting love jihad openly. — FilmySoup (@FilmySoup) October 12, 2020

Meanwhile, Congress leader Shashi Tharoor came out in support of the ad and tweeted his opinion about the ad and slammed 'Hindutva bigots' for calling for a boycott of Tanishq jewellery as a consequence of the commercial adverstisement.

In a post this morning he said:

""So Hindutva bigots have called for a boycott of ⁦@TanishqJewelry⁩ for highlighting Hindu-Muslim unity through this beautiful ad. If Hindu-Muslim “ekatvam” irks them so much, why don’t they boycott the longest surviving symbol of Hindu-Muslim unity in the world -- India?""",411,-0.9999606609344482
2020-10-08 13:56:00+05:30,https://www.moneycontrol.com/news/business/titan-montblanc-joint-venture-to-end-in-december-5938181.html,"Titan Company

Tata group firm Titan on Thursday said it will end its five-year joint venture with luxury firm Montblanc in December this year, to focus on its primary business and proprietary brands.

Titan holds a 49 percent equity stake in the joint venture (JV) –Montblanc India Retail Private Limited.

Titan entered into the JV with Montblanc Services BV, the Netherlands, for the operation of retail boutiques in India for Montblanc products.

""By mutual agreement, Montblanc and Titan Company Ltd, a consumer retail company within the Tata Group, announced today the ending of their joint venture partnership in India. The decision enables Montblanc to become a wholly owned subsidiary in the country,” Titan said in a regulatory filing.

Titan said its decision to exit the joint venture agreement was driven by the company’s consolidation strategy to focus on their primary business and proprietary brands. No financial details were disclosed.

During the five-year partnership which began in 2015, Montblanc opened 12 boutiques in major cities across the country and established a fast-growing e-commerce business through the luxury online portal TataCliq.

Today Montblanc is a leading global luxury Maison with the largest footprint in the country, Titan added.

Commenting on the next stage of the business in India, Nicolas Baretzki, CEO of Montblanc International, said: ""This is a market that holds strong long-term potential for Montblanc, and it is a mark of confidence that we now become a wholly owned subsidiary.”

C K Venkataraman, Managing Director of Titan Company Ltd said: We have decided that during these rather challenging times our primary business must take precedence. Both parties have greatly benefited from this partnership, and our relationship with Montblanc remains strong and positive.

In accordance with the joint venture agreement, the partnership will end in December 2020, Titan said.",297,0.9947016686201096
2020-10-05 21:56:00+05:30,https://www.moneycontrol.com/news/business/despite-rise-in-gold-prices-customers-looking-to-buy-gold-says-tanishq-ceo-5926461.html,"Representative image

live bse live

nse live Volume Todays L/H More ×

Despite a rise in gold prices, customers are keen on buying gold jewellery, said Tanishq chief executive officer Ajoy Chawla on October 5.

“Gold prices were high, at least until August, but still saw that there was continuous interest in gold,” said Chawla, CEO, Jewellery Division, Titan at a virtual event to launch its festive season collection Ekatvam.

Tanishq is the jewellery division of Titan.

He also said consumers who were fearing that gold prices may rise further were locking down their planned purchases.

“Many of them (customers) were buying for future events, not just the festival, but also for weddings. We believe, they wanted to lock-in in a way a certain gold rate by picking up some amount of gold, some of it was done in the form of jewellery, some in the form of gold bullion and some through buying gold coins,"" he said.

In August, 2020, gold prices had touched a high of about Rs 56,200 per 10 gram.

Gold prices rose by Rs 85 to Rs 50,498 per 10 gram in the Mumbai retail market on rupee depreciation and tepid global cues on October 5.

The rate of 10 gram 22-carat gold in Mumbai was Rs 46,256 plus 3 percent GST, while 24-carat 10 gram was Rs 50,498 plus GST. The 18-carat gold quoted at Rs 37,874 plus GST in the retail market.

New Launch

With festive season inching closer, Tanishq, a jewellery brand owned by Tata, launched the festive season collection called ‘Ekatvam’.

According to the company, the collection is inspired by the theme of ‘Oneness’ as the ornament is intricately knitted into one collection.

The collection will feature 15 different art forms, bound together as one masterpiece in each piece of jewellery.

The collection features designs Karigari techniques like Nakkashi, Rawa work, Kit-Kita work and Chandak layering.

Starting at Rs 40,000, the collection will be available across all Tanishq stores in India and on Tanishq’s e-commerce platform.",335,-0.8805555999279022
2020-08-20 10:47:00+05:30,https://www.moneycontrol.com/news/business/gold-glitters-but-watches-stop-ticking-for-titan-5731301.html,"Representative image

live bse live

nse live Volume Todays L/H More ×

Gold’s glitter seems to be taking the sheen off the diamond. Despite high gold prices, Titan has witnessed robust demand for gold jewellery, leaving behind woman’s best friend.

Diamonds are clearly not in favour as such, Subramaniam, Chief Financial Officer, Titan Company Ltd, told Moneycontrol in a telephonic interaction. Most customers who used to buy diamonds earlier are looking at buying gold at this point, he added.

“People are looking at buying gold more as a store of value, asset allocation and also as a safe haven. If you look at the stock market, people are wary of the market direction ahead; debt markets are yielding very low returns. Therefore, in the context of that, gold seem to be a safe-haven investment for most people,” Subramaniam said.

Jewellery rules

On a like-to-like basis, Titan is looking at reporting at least 80 percent of last year’s July revenue and is getting traction back in the jewellery segment. In August, so far, the company is ahead of last year, Subramaniam said, without revealing any numbers.

In Q2 (July-September) of FY20, Titan had reported revenue of Rs 3,528 crore against Rs 3,582 crore. Its jewellery business had done better than most players in the industry then.

Titan sells jewellery under the brand name Tanishq. The jewellery business is Titan's mainstay and accounted for 83 percent of its revenue in financial year 2020.

Apart from gold jewellery, Titan has also seen demand for gold coins in the past few months.

Gold seen as a safe haven

Since January 2020, gold prices have surged nearly 40 percent, tracking a rally in global rates and depreciation in the rupee against the US dollar.

Also, the rise in safe-haven demand and expectations that central banks and governments will maintain support for economies hit by the coronavirus have pushed gold prices to record highs.

On August 7, gold hit a record high of Rs 56,191 per 10 grams in the Mumbai bullion market. On August 19, the gold price closed at Rs 55,360 per 10 grams.

Subramaniam envisages gold prices will rise in the coming months and expects demand for gold jewellery to continue. The company will also open 20-30 new jewellery stores in the current financial year.

Down time

Titan suffered a loss in the quarter ended June as stores remained shut during the Covid-19 lockdown and consumers spent less on discretionary items.

The company said 83 percent of its stores had opened by the end of June. But even then, many were not operating on all days.

“With the negative consumer sentiment prevailing in the quarter, discretionary spends were very low and specifically impacted our watches business,” Subramaniam said.

The watches segment, which usually accounts for 12-15 percent of revenue for the company, was the worst hit as demand for the accessory drastically fell after the Covid outbreak. The segment recorded an 89 percent decline in revenue in the June quarter. The watches division comprises brands such as Fastrack, Sonata, Raga, Octane and Xylys.

Subramaniam indicated that demand for watches has not picked up in Q2 as well. Again, he did not share any numbers.

The disappointing earnings did not deter the company from launching new products. Titan announced the launch of its full-touch smartwatch ‘Connected X’ on Amazon India during Prime Day on August 6. The product has garnered a good response so far, Subramaniam said.

Outlook

Subramaniam expressed concern that overall numbers by the end of FY21 will be hit badly due to the pandemic.

However, he was quick to add that at least by the fourth quarter (January-March) of FY21 things may start getting back to normal.

“We may see a decline in our revenues for FY21 but hopefully by the fourth quarter, we may get into a sense of normalcy. So, FY22 should be a normal year with the hope that the vaccine will possibly come out by the end of this calendar year, which looks very, very probable now,” Subramaniam said.

The company also slashed its advertising spend in Q1 of FY21 by 86 percent. Even in Q2, ad expenditure is likely to remain muted. Subramaniam said, adding: “If the revenue starts ramping up from Q3 and Q4, we will increase ad spend.""

For the remaining quarters of FY21, Titan is pinning its hopes on a revival in demand during the festival season and weddings as people are likely to get used to the new normal.

“The festive season should be decent as most people have been cooped up in their homes since March. They would want to go out, shop, explore and enjoy during Diwali and Christmas. Additionally, weddings, which were to take place in Q1 and Q2, are being pushed to Q3 and Q4 (of FY21). So, lots of occasions coming up for us to take advantage,” he said.

Titan Company Ltd, a joint venture between the Tata Group and the Tamil Nadu Industrial Development Corporation (TIDCO), commenced operations in 1984 under the name Titan Watches Ltd. Titan is the fifth-largest integrated own-brand watch manufacturer in the world.",851,0.22303974001031174
2020-08-13 14:56:00+05:30,https://www.moneycontrol.com/news/business/stocks/reduce-titan-target-of-rs-950-hdfc-securities-5692931.html,"live bse live

nse live Volume Todays L/H More ×

HDFC Securities' research report on Titan

Titan’s demand across categories was severely impacted in 1QFY21 due to the COVID-led nationwide lockdown. Topline declined 62% YoY to Rs. 19.8bn. The road to recovery remains hazy as weak consumer sentiment meets rising gold prices. Jewellery sales (ex-bullion sale of Rs. 6bn) declined 71% YoY to Rs. 12.2bn (HSIE: Rs. 10.5bn). Impact on profitability was even more severe across categories, courtesy unfavourable operating leverage.



Outlook

Titan reported a Rs 2.5bn EBITDA loss in 1Q – a first! We largely maintain our FY22 EPS estimates and arrive at a DCF-based target price of Rs 950/sh (implying 48x Jun-22 P/E). Note: DCF rolled over to Jun-21.

For all recommendations report, click here

Disclaimer: The views and investment tips expressed by investment experts/broking houses/rating agencies on moneycontrol.com are their own, and not that of the website or its management. Moneycontrol.com advises users to check with certified experts before taking any investment decisions.

Read More",168,-0.019667774438858032
