Date,link,text,len,sentiment
2017-04-04 16:06:00+05:30,https://www.moneycontrol.com/news/business/companies/trust-transparency-innovation-3-pillars-that-hold-kalyan-jewellers-fort-in-india-2252485.html,"From left to right: RAMESH KALYANARAMAN, Executive Director, Kalyan Jewellers with T. S. KALYANARAMAN, Chairman & Managing Director and RAJESH KALYANARAMAN, Executive Director

By Varsha Meghnani

Forbes India

In a large, well-lit Kalyan Jewellers store in suburban Mumbai, a salesperson assists a couple pick out designs for their soon-to-be-married daughter. Elsewhere, a lady preens into a mirror, holding up glittering hoops against her ears. A red necktie-wearing salesman looks on intently. Amid the neatly arranged rows of necklaces, bangles, rings and earrings, what Kalyan Jewellers is really selling is trust. “Integrity is everything in the jewellery business,” says TS Kalyanaraman, 70, the founder and CMD of the company. “That was the most important lesson I learnt from my elders.”

Trust isn’t something new to the businessman. Over two decades ago, it’s this reputation that helped Kalyanaraman segue from his family business of textile manufacturing and retailing (set up in 1903) to his current calling. He recalls the overwhelming number of customers who would come to the family store—mostly to shop for weddings—and ask him to sell jewellery that would go with their clothes. If he sold ornaments, they would certainly buy from him, they would tell him. Their confidence inspired Kalyanaraman to open his first store in Thrissur, Kerala, in 1993. Today, Kalyan Jewellers has 82 showrooms in India, and 23 in the Middle East. Revenues stood at Rs 9,834 crore in FY16, up by 15 percent from the previous fiscal and well ahead of the Rs 8,700 crore notched by the country’s biggest listed jeweller, Titan, a Tata group company.

Right from the beginning, Kalyanaraman changed the play in a sector riven by malpractices. He stocked ready-to-wear ornaments at a time when made-to-order was the norm, introduced detailed rate tags and educated customers on how to verify the purity of gold. Even his first store, at 4,000 sq ft, was more than ten times the size of a regular jewellery store at that time. It is this “customer-centric model” that defines Kalyan Jewellers’ leadership position, says Vishal Mahadevia, managing director and co-head, Warburg Pincus India, which picked up an undisclosed minority stake in the jewellery chain for Rs 1,200 crore in 2014, representing the largest such investment in the jewellery industry in India. “They have successfully challenged conventional beliefs and created a strategy that has brought a noticeable shift in industry standards while expanding their geographical footprint,” says Mahadevia.

Read more stories from Forbes India here

Kalyanaraman made sure the expansion didn’t come at the cost of quality. He opened his second showroom, also in Kerala, seven years after the first. “My father wanted to be steady with the first showroom before expanding,” says older son Rajesh, 41, who entered the business in 1993 and looks into procurement and finance. Younger son Ramesh, 39, got involved with the business in 1998 and oversees marketing. Kalyan Jewellers went on to open showrooms across South India, and, in 2012, expanded into the western and northern regions of the country, roping in superstar Amitabh Bachchan as brand ambassador.

Over the next three years, the trio is targeting revenues of around Rs 15,000 crore as well as about 170 stores across India and abroad. The figures may sound ambitious, but with trust and professionalism continuing to be their bedrock, the future, clearly, glitters for Kalyan Jewellers.

(This article was first published in Forbes India)",561,0.9996767044067383
2016-11-30 19:56:00+05:30,https://www.moneycontrol.com/news/business/companies/titan-soon-coming-upaffordable-smartwatches-920110.html,"Buoyed by the response to its smartwatches, Titan is planning to introduce affordable models of the device under its other brands like Sonata and Fastrack in the next few months.

The company launched its first smartwatch Juxt in January this year.

""After the launch of Juxt, we ran out of stock, and we had to re-introduce it. Then we launched Juxt Pro and that is also doing very well. We are planning to launch quite a few smartwatches. Both (Juxt & Juxt Pro) are under the Titan brand but we will be seeing products coming out across our brands like Fastrack and Sonata,"" Titan Watches and Accessories CEO S Ravi Kant told PTI here.

He maintained smartwatch is an area of focus for Titan and said the new models will be in the below Rs 10,000 range.

""Fastrack smartwatch will command a little premium over a basic Fastrack watch. Similarly, a Sonata smartwatch will be a little more expensive than a Sonata watch, because of the technology involved. Both will have to be sub-Rs 10,000, while these (Juxt and Juxt Pro) cost around Rs 19,000- 20,000 and Rs 22,000,"" he said.

Worldwide smartwatch market size is expected to touch 500 million by 2020, according to analyst firm IDC.

Titan commands over 50 per cent market share in the wrist watch industry, estimated at Rs 6,000 crore. The watch unit contributes under 20 per cent to the company's turnover.

The leading watchmaker has over 600 outlets across its retail formats of World of Titan, Fastrack and Helios, and will be adding another 40-50 stores next year.

Kant said despite subdued sales for watches over the last few years, the category of expensive models in price range of above Rs 4,000-5,000 is growing faster than the other segments at 12-14 per cent.

On the impact of demonetisation on the business, Kant said, ""We had an impact certainly, after the first week, immediately after November 8, in retail and across all channels. Now retail has more or less bounced back.

""We are seeing some impact on the trade cycle because dealers, for them a lot of business is on cash as their customers pay in cash and they in turn pay in cash to their distributors. So, the whole channel is getting a little choked. The trade part hasn't recovered but on retail side a much higher percentage of customers are paying via credit cards."" Meanwhile, Titan today announced it has partnered US- based fashion brand Kenneth Cole to exclusively distribute the latter's watches in India.

""We partnered with Kenneth Cole in June but the formal launch is happening now. It is part of our strategy to bring international brands to India,"" Kant said.

Kenneth Cole is one of the eight brands in Titan's licence brand portfolio.",464,0.49981458485126495
2016-09-22 13:55:00+05:30,https://www.moneycontrol.com/news/business/companies/daimler-to-launch-sub-9-tonne-truckindia-next-year-962880.html,"Automaker Daimler AG is aiming to expand its product portfolio in India as it plans to launch sub 9-tonne trucks from next year, which will be sold both in domestic and export markets.

The new product range, which the company terms internally as 'Titan', would have trucks ranging between 6-9 tonnes.

""We will start in India with the product called Titan next year. We will start the products below 9-tonne from India to India and also to the world. That's very very important because now it's the third product,"" Daimler Trucks Asia Head Marc Llistosella told reporters here.

Stuttgart-based Daimler AG is present in India through a 100 per cent subsidiary -- Daimler India Commercial Vehicles (DICV).

The Chennai-based company currently sells medium duty and heavy duty trucks ranging between 9 and 49 tonnes in the country under the brand name BharatBenz.

Besides, the DICV-built FUSO trucks from Oragadam plant near Chennai are exported to markets in South East Asia, Africa, and Latin America.

Llistosella said, since starting operations in India four years ago, the company has so far sold 42,000 units in the country and exported another 7,000 trucks.

Besides, it has produced around 52,000-53,000 truck units till now from the same plant. The company exports its products mostly to Africa, Middle East and South America.

""We are going step by step to some countries in South America like Peru, Chile and Colombia. We are picking some good markets with good size where we can position ourselves exactly where new Fuso needs to be, "" Llistosella said.

On sales network he said :""We have over 100 sales points currently. Now, we have started our third wave of dealerships which are smaller because we need to be in the rural areas, this is where India is growing."" He also said that DICV is one of the biggest solar power producer entity in India.

""Roughly 35 per cent of our energy supply is from solar panels..in two years from now, we will be self-sufficient in energy which is really remarkable,"" Llistosella said.

Daimler has already invested Rs 5,000 crore at the Oragadam plant which is spread over 400 acres.

The company has a production capacity of 36,000 trucks per year from the plant, which can be doubled.

In June this year, it exported 5,000 units, less than three years after the start of overseas shipments in 2013.

DICV and Mitsubishi Fuso Truck and Bus Corporation (MFTBC) jointly operate in an organisational union under the umbrella of Daimler Trucks Asia (DTA).

Daimler Trucks Asia is not a legal entity, but a strategic business model which allows its group entities to collaborate in product development, production, exports, sourcing and optimising research activities.",449,0.9271636009216309
2016-05-20 20:18:00+05:30,https://www.moneycontrol.com/news/business/companies/funding-squeeze-causing-stricter-evaluatione-comm-models-997326.html,"A tightening funding environment has prompted Indian e-commerce ecosystem to adopt stricter evaluation norms for business models, with focus on profitability and consolidation, a report said.

""We believe this (e-commerce) shake-up may intensify further, leading to the emergence of one or two strong companies within each sub-sector,"" said the research report by Kotak Institutional Equities.

A lack of fresh funding as well as stricter focus on profitability by investors is leading to swift business model changes by companies, it said.

Further, the current wave of consolidation among e-commerce players may intensify, leading to fewer, stronger players emerging within each category.

""Low valuations may prompt brick-and-mortar companies to take over some e-commerce rivals, in a bid to make an online presence for themselves like Titan's purchase of Caratlane and Future Retail's purchase of Fabfurnish,"" it said.

Further, recent government regulations clamping down on discounts and dependence on single large vendors may necessitate further changes in strategy and could impact sales growth in the near term, the report added The hyper-valuations seen in successive funding rounds in 2014-15 also seem to be correcting, it said.

Fidelity had marked down its holding in Flipkart by about 40 per cent as of February 2016 (compared to August 2015), implying that the firm's valuation may now be significantly lower than peak valuation of USD 15.2 billion attained in 2015.

Valuation of Rocket Internet's Global Fashion Group (parent company of Jabong) plummeted by about 67 per cent during its last fund raise in April 2016, while Fabfurnish was acquired by Future Group at a substantial discount for USD 3 million, the report noted.

The report also indicated that hyper-local category seems to be the worst-hit among e-commerce players.

Companies like grocery delivery firm PepperTap shut its delivery business and is focusing only on logistics, while delivery company Roadrunnr has merged with food-ordering app Tinyowl.

Several other portals such as Foodpanda, Jabong and Housing are also reportedly on the block, it noted.",325,-0.6521036823590597
2016-02-02 16:29:00+05:30,https://www.moneycontrol.com/news/business/stocks/buy-titan-targetrs-400icicidirect-1045062.html,"live bse live

nse live Volume Todays L/H More ×

ICICIDirect's research report on TitanTitan Company’s (Titan) Q3FY16 results were above our estimates on the revenue, EBITDA and PAT front. Higher jewellery revenues were mainly driven by GHS and early end of discount sale in December Revenues grew 17% YoY to | 3426 crore. The jewellery segment grew 20% YoY to | 2820 crore while the watches segment increased marginally by ~8% YoY to | 478 crore The EBITDA margin declined 40 bps YoY to 9.1% vs. our expectation of 9.12%. On the segmental front, the watch segment reported an EBIT margin of 6.77% (down 294 bps YoY) while the EBIT margin of the jewellery segment grew 33 bps YoY to 10.26%, driven by strong revenue growth Consequently, PAT grew 18.1% YoY to | 225.3 crore vs. our expectation of | 198.7 crore With most regulatory concerns reduced and gold supply improving coupled with a reduction in gold prices & making charges, we expect revenue growth to revive, going forward. We remain positive on Titan considering (a) the shift in demand to the organised segment; (b) healthy financials; (c) continuing retail expansion and entry into new product segments. We expect revenue and net profit to grow at a CAGR of 8.7% and 10.4%, respectively, in FY15-18E. We maintain our positive stance on Titan with a revised target price of | 400 (based on 32.0x FY18E EPS of | 12.5). We have a BUY recommendation on Titan Company. For all recommendations, click here Disclaimer: The views and investment tips expressed by investment experts/broking houses/rating agencies on moneycontrol.com are their own, and not that of the website or its management. Moneycontrol.com advises users to check with certified experts before taking any investment decisions.

Read More",293,0.9999997615814209
2015-12-08 10:46:00+05:30,https://www.moneycontrol.com/news/business/companies/titan-appoints-directors-for-new-jvmaison-montblanc-1485431.html,"Titan has appointed three directors, including its Managing Director Bhaskar Bhat, on the board of its new joint venture (JV) with Maison Montblanc which will carry out single brand retail trading of Montblanc’s products in India.

The other two directors are Titan Co-CEO of Watches and Accessories Division S Ravi Kant and Independent Director Ireen Vittal.

The appointment is as per the agreement between the two partners, under which Titan has the right to appoint three out of six directors, the company said in a BSE filing.

The JV has “equity participation pursuant to FIPB approval in the ratio of 51:49 by Montblanc Services BV and Titan Co Ltd, respectively”, it added.

The equity share capital of the JV company after allotment on December 5, 2015 is Rs. 41.50 crore comprising 4.15 crore shares of Rs.10 each, Titan said.

Montblanc, which is re-entering India will open five boutiques in the next three months in Mumbai, Delhi, Hyderabad and Pune through the joint venture.

In December, two boutiques would be opened at Palladium Mall in Mumbai and Taj Mahal Hotel in Delhi, which would have collections of Maison’s innovative writing instruments, fine jewellery for men and women and artisanal leather goods.

Titan would operate a dedicated customer service centre to ensure convenience and service for clients in India.

Titan is a joint venture between the Tata group and the Tamil Nadu Industrial Development Corporation.",233,
2015-12-07 22:35:00+05:30,https://www.moneycontrol.com/news/business/companies/tata-group-eyes-36350-billion-market-cap-by-2025-1486605.html,"live bse live

nse live Volume Todays L/H More ×

With its listed firms adding over USD 100 billion to market capitalisation in the last 15 years, the Tata Group is looking at an increase of nearly USD 250 billion by 2025, including through acquisitions.

The group will not shy away from global buyout activity and will continue to make significant investments in both existing as well as new businesses, including in the digital space to meet its vision 2025 targets.

It is looking to build on the platform set up by its previous Chairman Ratan Tata, who made ‘the difference’ and transformed the group from a largely India-oriented entity into a global multinational.

“At the turn of the century, we had a relatively small market cap of just under USD 8 billion. We have added a 100 billion dollars plus to that in the last 15 years. I am quite confident that this will continue to grow,” Member — Group Executive Council and Brand Custodian, Tata Sons, Mukund Rajan told PTI.

The Tata Group has over 100 independent operating companies out of which 29 are publicly-listed. The listed entities had a combined market capitalisation of about USD 134 billion as on March 31, 2015. It has presence in over 100 countries across six continents. The main listed Tata group companies, include Tata Steel, Tata Motors, Tata Consultancy Services, Tata Power, Tata Chemicals, Tata Global Beverages, Tata Teleservices, Titan, Tata Communications and Indian Hotels.

2025 vision

When asked about the target M-cap under the group’s 2025 vision, Mr. Rajan said: “Today we are well over USD 100 billion.

By 2025, if we want to be amongst the 25 most valuable companies in the world, the number we would need to hit would be around USD 350 billion.”

As per its 2025 vision, Tata group aims to be amongst “the 25 most admired corporate and employer brands globally, with a market capitalisation comparable to the 25 most valuable companies in the world.” Recollecting how the Tata group has grown, Mr. Rajan said: “In 2000, we were principally an India-based group with 20 percent of our turnover generated outside India. Fast forward 15 years, and we are now substantially a global group with USD 108 billion of turnover, 70 percent of it generated outside of India.”

The group has been growing both in the publicly listed space and also in the unlisted space, he added.

“If you look at the true valuation of Tata enterprises (today) as a group, it would in fact be substantially higher than what the additional USD 100 billion of market cap represents,” he said.

Elaborating on the role played by Tata Sons Chairman Emeritus Ratan Tata in transforming the group, Mr. Rajan said: “Where we are today, owes much to the critical strategic choices that Mr Tata made after India started liberalising and opening up its market.” Tata had decided to benchmark the group with the best in the world and “not just confine the group to the domestic market but to become an international player”.

“What was clear to Mr.Tata in the 1990s was unless we were able to hold our own against the best in the world, foreign competition would come into the domestic market and encroach on our market share and business,” he added.

Underlining Tata’s risk-taking ability and strong leadership, Mr. Rajan said: “Very often you say that one man can make the difference. I can confidently assert that for Tatas that one man was Mr. Ratan Tata. If we had not had him as our leader, I do not believe we would be in the position that we are in today.”

With the group taking the acquisition route successfully, such as Tetley, JLR and Corus to expand globally, it will not shy away from such activity again.

“I can’t predict what the future will bring to us but what I can certainly say is that thanks to Mr.Tata we have the courage to make such acquisitions and when opportunities present themselves, we will appropriately deploy our learnings from the past in any future acquisitions,” Mr. Rajan said when asked if there could be as big an acquisition as Corus or JLR by the Tata group again.

Clearly stating the group’s appetite for inorganic route of growth, he said: “We have significant cash on the books of many of our companies. When we contemplate acquisitions, the timing will have to be picked carefully and we will need to pick the right moment in the economic cycle to close those acquisitions.”

Mr. Rajan, however, said apart from acquisitions the group would need to continue to make significant investments in both existing businesses and some of the new businesses, including in the digital space to meet its vision 2025 targets.

“There are new markets that we need to expand our footprint in. Obviously, markets like China will continue to grow in stature and size and we need to correspondingly ensure that our focus in those markets is also enhanced,” he said.

Besides, Mr. Rajan said: “We need to see growth in multiple domains, and multiple markets, including India. India also offers dramatic growth opportunities, and with the kind of projections being made for India, a significant part of our growth will come from this market also.”",881,0.7212236970663071
2015-11-02 12:14:00+05:30,https://www.moneycontrol.com/news/business/markets/sensex-nifty-continue-to-skid-bajaj-auto-tanks-4-1478123.html,"Moneycontrol Bureau11:45 am Market outlook: The market does not appear to be particularly volatile, in fact it is in the normal range of volatility, says Vetri Subramaniam, CIO of Religare Invesco Mutual Fund. The trading range of the market is 15 percent, he says. Global newsflow has been strong and that is having an impact on the markets, but that's about it, he adds. However, big disappointments have come from earnings downgrades over the past few quarters. This time too, earnings are trending lower, he says. According to him, FY16 and FY17 growth estimates are likely to be revised lower by the end of the earnings season. As far as the Bihar elections are concerned, he says people always like to play up important state elections as the mood of the electorate and a referendum on policy making at the Centre. But, he is not sure whether the outcome of the polls will make a huge difference.11:30 am Buzzing: Shares of Jet Airways soared 8 percent intraday after it got itself a new maverick investor. Ace investor Rakesh Jhunjhunwala purchased 1.05 percent stake in the airline company for Rs 50.52 crore through an open market transaction. Jet Airways had gained 11 percent on Friday. According to the bulk deals data available with NSE, Jhunjhunwala's RARE Enterprises acquired 11,95,000 shares or 1.05 percent stake in the private airline. The shares were bought at an average price of Rs 422.76, valuing the transaction at Rs 50.52 crore.Don't miss: Cold coffee: Cafe Day owner firm falls 14% on debut day

The market is sliding away as the the Sensex is down 128.95 points or 0.5 percent at 26527.88. The Nifty slips 34.85 points or 0.4 percent at 8030.95. About 820 shares have advanced, 1260 shares declined, and 86 shares are unchanged.

Capital goods, metals and pharma stocks are falling sharply. Hit by weak October sales, Bajaj Auto is down 4 percent. Hindalco, Lupin, Tata Steel and L&T are major losers in the Sensex. Among the gainers are M&M, ICICI Bank, Tata Motors, Maruti and Axis Bank.

Oil prices fell in as analysts expected weaker demand from China in upcoming months. The weakness came after gains made last week following a further decline in the US oil rig count which indicated that domestic crude production could drop in coming months.

But in Asia, the possibility of slowing demand in China dominated trade on Monday, with growth faltering in the world's No.2 economy.",408,-0.9999948740005493
