Date,link,text,len,sentiment
2023-11-23 22:58:00+05:30,https://www.moneycontrol.com/news/business/companies/indias-smartwatch-market-soars-21-yoy-domestic-manufacturing-hits-all-time-high-11800401.html,"Commenting on the price analysts noted the emphasis on budget-friendly options has led to a significant 41 percent year-on-year decline in India's smartwatch average selling price (ASP), reaching its all-time low

India witnessed a remarkable 21 percent year-on-year (YoY) growth in smartwatch shipments during the third quarter of 2023 (July-September), according to the latest research from Counterpoint's IoT Service. The surge was attributed to a significant inventory build-up in anticipation of robust sales during the festive season in October.

While existing top players continued to drive the market, new players like Fastrack and beatXP shipped high volumes and chipped away market share from the top three. The share of domestic manufacturing reached the highest ever at 82 percent compared to 4 percent a year ago, the report added.

While existing top players continued to drive the market, new players like Fastrack and beatXP shipped high volumes and chipped away market share from the top three.

“In the coming years, the market will continue to grow in double digits due to the brands’ efforts to expand their portfolios, offline partnerships with several large-format retailers (LFRs) and growing emphasis on local manufacturing,” said Anshika Jain, senior research analyst.

Fire-Boltt emerged as the market leader, capturing an impressive 28 percent share, closely trailed by Noise and boAt. Notably, Fastrack, a sub-brand of Titan, achieved the highest annual growth among the top five brands, showcasing its increasing prominence in the sector. Additionally, beatXP made its debut in the top five, marking a notable entry into the competitive smartwatch market.

Commenting on the price analysts noted the emphasis on budget-friendly options has led to a significant 41 percent YoY decline in India's smartwatch average selling price (ASP), reaching its all-time low. Consequently, more than three-fifths of the market now falls within the less than Rs 2,000 price range.

“This quarter, smartwatches were even available for less than Rs 1,000 to target first-time users. The shorter replacement cycles for the basic smartwatches and the maximum number of new launches being in this price segment further accelerated the trend,” said Harshit Rastogi, Research Analyst.",347,0.4838695228099823
2023-11-23 13:24:00+05:30,https://www.moneycontrol.com/news/business/markets/titan-surges-past-the-highest-target-price-hits-rs-3-lakh-crore-market-cap-what-now-11795371.html,"Expansion is likely to be a key source of surprise for Titan's revenue growth, opening up levers of growth that were not available even 2-3 years back.

Titan Company crossed the Rs 3 lakh crore market share on November 21. The stock has seen a strong momentum through this year, gaining 34 percent and about 6 percent in November alone. It hit a fresh 52-week high of Rs 3,441.45 on the National Stock Exchange (NSE) on November 23. Can this momentum continue?

Most analysts are bullish on Titan, what with its impressive growth in the jewellery business and its premium position in the sector. There are, however, some cautious voices. They point out that low diamond prices might put pressure on profitability.

In its Q2FY24 results, the company’s consolidated net profit rose 9.7 percent on-year to Rs 916 crore, while consolidated revenue jumped 36 percent to Rs 12,529 crore. The jewellery business grew, driven by India operations, and domestic sales were aided by a double-digit growth of buyers and average bill value per buyer.

Follow our market blog to catch all the live action

Outlook

Analysts believe that Titan's core domestic business has a long runway for growth. Going ahead, market expansion, buoyant gold prices, and robust demand during the wedding season, will boost profitability.

Titan has taken some price correction in solitaires and this impact should be evident in the coming 7-8 months, said Jefferies in a report.

According to the international brokerage, Titan is a structural growth story. Buoyant gold prices, share gains, higher wedding budgets for jewellery, and cost focus are among the key catalysts for the stock. However, concerns remain over steep valuations.

Margins to improve

In the quarter gone by, the benefits of low-cost inventory faded out completely and plain gold jewellery sales increased. This impacted margins. The management has allayed investor concerns on the margin impact from the recent correction in diamond prices.

""The impact would be limited to the solitaire portfolio, which has a low salience in Titan's studded business. The management, in its guidance, reiterated that it is aiming for 12-13 percent margins on an annual basis,” Jefferies added.

According to Dolal Capital, an increase in studded jewellery contribution would help improve EBITDA margin. Going ahead, the company expects 12-13 percent steady-state margins in the jewellery business (ex-bullion sales). Aggressive pricing by the company is expected to ease, leading to improved margins in the future, according to B&K Securities analysts.

Also Read | Titan stock extends gains on CCI nod to acquire additional stake in CaratLane

Market expansion

The company continues to expand its jewellery store reach. During the quarter that ended in September 2023, Titan added 52 stores for its jewellery brands Tanishq, Mia, CaratLane and Zoya. The company also said it was looking to add 15 stores for Zoya by next Diwali.

According to analysts at CLSA, this expansion is likely to be a key source of surprise for Titan's revenue growth, opening up levers of growth that were not available even 2-3 years back.

Growth

Titan is concentrating on increasing its market share by expanding its store network, enhancing inventory, and offering competitive pricing.

The company has established ambitious long-term goals across various segments with a primary focus on profitability. With the watches and eyewear divisions complementing the jewellery business, Titan’s long-term growth outlook appears promising, according to B&K Securities. ""We remain optimistic about Titan from a stable, long-term perspective,"" the brokerage said.

Analysts at Dolat Capital expect Titan's profitability in the second quarter of FY24 to remain under pressure due to low diamond prices. The jewellery business has seen a sharp acceleration in new store additions, across formats over the past four quarters.

Going ahead, the jewellery business is estimated to post double-digit revenue growth, and will be a bedrock for growth for the company.

Also Read | CDSL jumps 3% as demat accounts cross 10-crore mark

Valuations

JM Financial Services expects Titan to continue commanding a premium valuation, more so given the scarcity of ‘growth businesses' in the space at this point.

It maintained a ‘buy’ rating on the stock with a target price of Rs 3,705 per share. Jefferies, meanwhile, has maintained a 'hold' rating with a base case target price of Rs 2,950 per share, given the lofty valuations.

""At 43x FY26, Titan trades at a 10 percent premium to our consumer coverage. However, we believe Titan can grow significantly faster over FY23-26E and beyond as it makes further inroads into the rapidly growing luxury market as well as for the Indian jewellery market overseas,"" said CLSA as it maintained a 'buy' rating on the stock with a target price of Rs 3,338.25.

Its core domestic business and several of its new categories have a long runway for growth. This means investors should pay growth multiples for several more years, the brokerage added.

Meanwhile, B&K Securities has maintained its 'buy' rating on the counter with a revised DCF-based target price of Rs 3,350 from Rs 3,000 earlier. Dolat remained bearish on the stock as it put a 'sell' rating on the counter with a target price of Rs 3,185 per share.

With the recent rise in the share price, the best target price for the stock has already been achieved. The stock is now just below Jefferies' upside target price of Rs 4,500 per share.

Disclaimer: The views and investment tips expressed by investment experts on Moneycontrol.com are their own and not those of the website or its management. Moneycontrol.com advises users to check with certified experts before taking any investment decisions.",927,0.8157407194375992
2023-11-21 22:34:00+05:30,https://www.moneycontrol.com/news/business/titan-gets-cci-nod-for-additional-stake-purchase-in-caratlane-11784281.html,"Titan gets CCI nod for additional stake purchase in CaratLane

Fair trade regulator Competition Commission of India (CCI) on November 21 cleared the acquisition of additional stake purchased by Titan in CaratLane. CaratLane is engaged in the business of manufacture and sale of gems and jewellery in India.

The combination relates to the acquisition of 27.18 per cent share capital of CaratLane (a subsidiary of Titan) by Titan Company Ltd, on a fully diluted basis, from Mithun Padam Sacheti, Siddhartha Padam Sacheti, and Padamchand Sacheti, according to a release. Titan, a joint venture between the Tata Group and the Tamil Nadu Industrial Development Corporation (TIDCO), is active in several businesses through lifestyle brands, including jewellery, eye care, fragrances, and fashion accessories.

In August, jewellery maker Titan announced that it is going to increase its stake in its subsidiary and new-age jewellery brand CaratLane to 98.28 per cent by acquiring an additional 27.18 per cent for Rs 4,621 crore. CaratLane was started as a purely online brand in 2008, looking at the fast-growing affordable and accessible jewellery market.

Titan first invested in CaratLane in 2016 and over the years, in partnership with its jewellery brand Tanishq, CaratLane witnessed substantial growth. The deals beyond a certain threshold need approval from the regulator, which keeps a tab on unfair business practices as well as promotes fair competition in the marketplace.

Meanwhile, shares of Titan hit a 52-week of Rs 3,400 apiece up nearly 2 per cent on the BSE on November 21, while the company's market cap increased to Rs 3.01 lakh crore. By crossing Rs 3 lakh crore market cap, the company became the 17th most valuable company in India by market capitalisation. It is also the second-most valuable company among Tata Group firms behind Tata Consultancy Services (TCS).",297,0.9705295860767365
2023-11-21 17:50:00+05:30,https://www.moneycontrol.com/news/business/stocks/titan-market-cap-crosses-rs-3-lakh-crore-as-stock-hits-52-week-high-11782471.html,"Titan | CMP Rs 3,394.15 | Titan’s shares closed 1.4 percent higher as the company’s market cap reached Rs 3 lakh crore. The stock also hit a 52 week high.

live bse live

nse live Volume Todays L/H More ×

Titan’s stock hit a 52-week high of Rs 3,400 on November 21 as the company’s market capitalisation increased to Rs 3 lakh crore.

The stock closed at Rs 3,392.2, up 1.39 percent from the previous day’s close.

Titan first scaled Rs 1 lakh crore market capitalisation on March 28, 2019. After that, the stock took 18 months to scale the next Rs 1 lakh crore market cap as the market cap crossed 2 lakh crore on October 7, 2021. It took a little more than 2 years for the company to reach Rs 3 lakh crore from Rs 2 lakh crore.

By crossing Rs 3 lakh crore market cap, it became the 17th most valuable company in India by market capitalisation. The company which is backed by Tata group is also the second valuable company among Tata group behind TCS.

Titan is one of the most famous stocks in the portfolio of the late big bull Rakesh Jhunjhunwala. According to the shareholding pattern by September 30, 2023, Rekha Jhunjhunwala, wife of Rakesh Jhunhunwala holds 5.37 percent in the company. At the current market price, that holding translates to well over Rs 16,000 crore.

Titan group’s shares have risen 32.39 percent in the year-to-date period, beating the returns of benchmark index Nifty 50 which has risen by 8.7 percent.

Disclaimer: The views and investment tips expressed by experts on Moneycontrol are their own and not those of the website or its management. Moneycontrol advises users to check with certified experts before taking any investment decisions.",294,0.9999669194221497
2023-11-06 09:40:00+05:30,https://www.moneycontrol.com/news/business/markets/short-call-enough-fodder-for-bulls-to-help-diwali-dazzle-titan-godrej-properties-cello-siemens-in-focus-11670381.html,"Domestic flows keep acting as a floor for markets.

“The only problem with market timing is getting the timing right.” - Peter Lynch

In India, it's the time of the year when people scour for something, if not everything, new. Frugality takes a backseat as they invest in gold, real estate, cars, appliances, and even, stocks.

Long lists of Diwali stock-picks have begun circulating in WhatsApp groups. Whether the start of a new Samvat is a good time to enter the market is any one’s call, but long-term investors need not worry. Festive cheer may keep markets buoyant this week with no dearth of positive vibes from across the world. While domestic flows keep acting as a floor for markets, hopes of return of foreign investors have firmed up as US Treasury yields have corrected sharply.

Titan

The company exceeded estimates on all fronts, underlining India’s K-shaped recovery. While staple companies have found it difficult to give more

than 7 percent revenue growth, Titan Company in discretionary has grown 37 percent on a high base. CLSA has upgraded the stock from 'outperform' to 'buy' and has hiked the price target from Rs 3,540 to Rs 3,948. “The company is selling to all consumers that can spend,” said the broker.

The management in concall said that a drop in diamond prices, particularly in higher-carat solitaires might lead to a margin dilution over the next seven to eight months. But, analysts are not too worried, it seems. The company is now expanding its market share by targeting the low-market share and luxury high-value space in domestic markets as well as overseas, which is the next growth trigger, they feel.

Luxury stocks are fancied globally right now with the rich continuing to be on a spending spree post-pandemic; so as long as the company can extract a fair share of this unfair spending, the stock will offer an unfair advantage.

Godrej Properties

With Friday's rally, the technical reasons are supportive, but fundamentally, Godrej Properties is among the most expensive bets in the listed real estate space. It has highest trailing P/E multiple, right after Brigade Enterprises. But Motilal Oswal sees it differently. The stock’s one-year forward P/E is at 38 percent discount to its 10-year average, which makes it among the top picks for the domestic broking firm in the midcap space.

The management told CNBC-TV18 that they have a significant project pipeline for the second half of FY24. The Mumbai-based real-estate developer is hopeful of exceeding its sales guidance of Rs 14,000 crore for FY24. Foreign institutional investors are also buying into this story with their holding up from 28.85 percent in June to 29.25 percent in September.

Real estate is anyway a micro market and each company follows a different path based on its business model and performance of the market it caters to. With a lull in India's Silicon Valley, this is Mumbai's time, and hence Godrej's.

Also Read: MC Pro Inside Edge: D-Street biggie cashes biotech cheque, Agent Vinod’s NSE sales, Big Papa sits tight

Cello World

The Cello World IPO received a decent response, and analysts expect the stock to list at over 24 percent premium to its issue price today. The company's strong financials, debt-free status and big anchor names make it an attractive investment, but the concern is that it seems expensive compared to its peers. The P/E ratio is 49, which is much higher than the peer average of 38.6. Also, investors generally have a cautious view on pure OFS (offer for sale) public issues that simply provide an exit to existing investors and no money goes to the business. Cello World IPO was pure OFS.

Siemens India

There are stocks where the even the most marquee investors choose to ignore governance concerns because the business is too good to ignore. Siemens is one of them, where their tech capabilities and the growth story is makes it unbeatable. But the narrative seems to be changing a bit. Now, the stock has 15 buy, six hold and six sell calls.

One of those neutral calls is that of UBS. It has downgraded the stock from a 'buy' and lowered the target price from Rs 4,280 to Rs 3,750 on growing uncertainties about its long-term product strategy and concerns about the company's ability to win technology-based energy orders due to competitive dynamics.

Investors may also grapple with the market valuation of its energy business. Siemens Energy is now looking to sell its 24 percent stake in Siemens India to Siemens AG. This comes five months after the company’s decision to hive off its low-voltage motor business, which shareholders voted against as the valuations were ""ridiculously"" low for a good-margin, asset-light business. Seems like corporate governance issues are not done yet.

Beyond the Great Wall

China will further expand its market access and step up imports, Premier Li Qiang told a trade fair in Shanghai on Sunday, reports Reuters. This comes amid criticism from firms in the West that wanted to see more tangible improvement in the country's business environment.

Li told the opening ceremony of the annual China International Import Expo that the country was committed to opening up its economy, and that imports of goods and services were set to reach a cumulative $17 trillion within the next five years. ""No matter how the world changes, China's pace of opening up will never stall, and its determination to share development opportunities with the world will never change,"" Li said.

Also Read: MC Pro Inside Edge | Profitable exit hopes, appliance trouble, rebuilding bridges, discount wars, prop tricks

Time for alarm bells?

Warren Buffett-led Berkshire Hathaway has posted its first quarterly loss in a year as the prices of Apple and other stocks it owns fell, even as improved results from insurance helped boost operating profit to a record. Berkshire also signalled it remains cautious about stock valuations and the market environment. Operating profit rose 41 percent to $10.76 billion, even as Berkshire's net loss more than quadrupled to $12.77 billion.

Poor Charlie’s Almanack

Charlie Munger, Berkshire Hathaway vice-chairman and long-time business partner of Warren Buffett, was at his usual best in an interview with the Wall Street Journal as he mused on a wide array of topics. What caught our interest, in particular, was his advice for the common investor.

“Most people probably shouldn’t do anything other than have index funds…. That is a perfectly rational thing to do for somebody who just doesn’t want to think much about it and has no reason to think he has any advantage as a stock picker. Why should he try and pick his own stocks? He doesn’t design his own electric motors and his egg beater,” he said.

Hands off hedge funds!

Ken Griffin, the founder and chief executive of the $62-billion US hedge fund Citadel, has warned regulators that they should focus on banks rather than his industry if they want to reduce risks in the financial system stemming from leveraged bets on US government debt, reports FT.

Global regulators have warned about growing risks emerging from the so-called Treasury basis trade — selling Treasury futures while buying US government bonds and extracting gains from the small gap between the two using borrowed money.

“The SEC is searching for a problem,” Griffin told the Financial Times. “If regulators are really worried about the size of the basis trade, they can ask banks to conduct stress tests to see if they have enough collateral from their counterparties.”

With inputs from Abhishek, Shailaja, Yash, Anishaa and Srushti",1258,0.16784284114837647
2023-09-23 08:37:00+05:30,https://www.moneycontrol.com/news/business/bluestone-set-to-close-rs-550-crore-funding-zerodha-cofounder-nikhil-kamath-to-infuse-rs-100-crore-11413481.html,"Bluestone founder and CEO Gaurav Singh Kushwaha. (File photo)

Zerodha co-founder Nikhil Kamath is set to pump in Rs 100 crore into Bluestone, an omnichannel jewellery retailer, as competition heats up in the space. The investment comes as part of a funding round in which other notable participants include Zomato founder and chief executive Deepinder Goyal and CEO Amit Jain, and financial services firm IIFL, a report said.

Bluestone founder and CEO Gaurav Singh Kushwaha confirmed the development, saying the Bengaluru-based company was in the final stages of securing a funding round amounting to $65 million (around Rs 550 crore), valuing the company at around Rs 3,600 crore ($440 million), the Economic Times reported on September 23.

Also Read: D2C brands are preparing for the next 200 million internet shoppers

Moneycontrol couldn’t verify the report independently.

Ranjan Pai, chairman of Manipal Group, and Info Edge Ventures are also involved in the funding round, contributing around Rs 100 crore each. Existing investors, too, are participating in this funding round, Kushwaha told the daily.

The latest round of financing for Bluestone comes after Tata Group’s Titan acquired the stake of Mithun Sacheti, the founder of CaratLane, a rival omnichannel retailer, valuing the company at approximately $2 billion.

Bluestone earlier raised $30 million from the family office of Sunil Kant Munjal of the Hero Group, which valued the company at $378 million, the report said. These developments highlight the competitive dynamics and investment activity within the omnichannel jewellery retail sector in India.

Also Read | 'Trading is like dating': Zerodha's Nikhil Kamath talks about his best and worst investments

“We will expand on what’s working for us — the omnichannel play. We have 175 stores and there is definitely space to have 500-600 stores eventually,” Kushwaha told the financial daily.

He added that there was significant traction across cities, from tier 1 to tier 3, emphasising the vast opportunities that lay ahead for the company. A substantial portion of the newly secured capital would be allocated towards expanding the omnichannel presence and investing in technology to seamlessly integrate and optimise operations.

Established in 2011, Bluestone is one of the early entrants in the vertical ecommerce sector but in the past 18 months, it has turned around its operations by laying emphasis on establishing an offline presence.",383,0.9421674013137817
2023-08-25 20:24:00+05:30,https://www.moneycontrol.com/news/business/startup/co-founder-avnish-anand-elevated-as-ceo-of-caratlane-with-immediate-effect-11260101.html,"File photo

Avnish Anand, the co-founder of CaratLane has been appointed as the startup’s new chief executive officer (CEO) with immediate effect. The decision comes just days after his co-founder and former boss, Mithun Sacheti, made a remarkable exit by selling his CaratLane shares to Titan.

Last week, Titan, which already holds 71.09 percent in CaratLane, said it would further increase its stake to 98.28 percent by buying out Sacheti’s 27.18 percent share in the online jewellery retailer for Rs 4,621 crore. The deal valued CaratLane at Rs 17,000 crore. It also marked the second biggest e-commerce exit in India, just after Walmart’s $16 billion deal for Flipkart which gave both founders, Sachin Bansal and Binny Bansal, over $1 billion each.

About a week after Sacheti’s exit, Anand has now been promoted from his previous role as the Chief Operating Officer (COO) of CaratLane.

“Avnish (Anand)... was employee No.1 at CaratLane and an integral part of the founding team. He has played a stellar role in building CaratLane into what it is today,” the company said in a statement.

Anand has been with the company for over eight years. The press statement also said that co-founder Gurukeerthi Gurunathan will continue to play an important role as the Chief Technology Officer of CaratLane.

While Sacheti made Rs 4,621 crore from his exit, he also made sure top-level employees at the company get rewarded handsomely in ESOP payouts. About 75 CaratLane employees are set to receive about Rs 340-30 crore, Moneycontrol had reported earlier.

“Mithun has been a pillar of support and a sounding board for all my ideas these past years, so of course it’s sad to see him go. But I’m really excited for this new chapter as we have a great opportunity to build a bigger and more remarkable business in front of us,” CaratLane’s new CEO Anand said in the statement.",313,0.9825087984402975
2023-08-22 16:59:00+05:30,https://www.moneycontrol.com/news/business/live-caratlane-founder-mithun-sacheti-on-the-glittering-rs-4621-crore-deal-with-titan-exclusive-11237961.html,Get ₹100 cashback on checking your free Credit Score on Moneycontrol. Gain valuable financial insights in just two clicks! Click here,21,0.5457684993743896
