Date,link,text,len,sentiment
2023-02-01 08:17:00+05:30,https://www.moneycontrol.com/news/business/markets/budget-2023-as-discretionary-demand-dwindles-industry-wish-list-runs-long-nirmala-sitharaman-9948201.html,"FY22 was a stellar year for companies in the discretionary spending sector. Pent-up demand after the pandemic-induced lockdowns boosted the top line of most companies – paints, quick service restaurants (QSRs), consumer electronics, and apparels.

The 290 companies that make up the BSE Consumer Discretionary Index posted an over 19 percent year-on-year growth in sales and 170 percent YoY increase in net profit.

However, FY23 has turned out to be sombre so far. For the half-year ended September 2022, the net profit of the pack fell 25 percent compared to the six-month ended March 2022, while sales grew 3 percent. The index has fallen almost 40 percent last year compared with a 21 percent gain in the year before.

Operating margins of companies catering to discretionary spending have contracted over 100 basis points on the back of rising raw material prices. And the prospects for FY24 don’t look too bright either.

Also Read: Budget 2023: FMCG industry wants Bharat to spend more to bring back volumes

“We suspect the slowdown in discretionary consumption is due to a combination of factors: possible slowdown in new hiring in the organised sector, withering of pent-up demand, especially after the festive season, elevated inflation sapping household savings, and increase in mortgages due to a sharp jump in interest rates,” Kotak Institutional Equities said.

This became evident in the Q3 numbers. Asian Paints and Pidilite both posted volume growth that was little changed against expectations of 4-5 percent growth. Both flagged demand strain in the rural and semi-urban areas.

Electrical consumer goods company Havells reported a 7.2 percent fall in quarterly profit, citing “moderating” consumer demand.

Also Read: Havells shocks investors with Q3 numbers, brokerages lower target price

“For quick service restaurants, we were expecting same-store sales growth of 8-10 percent in FY23, but it looks like we will end the fiscal with only 5-6 percent growth,” said Karan Taurani, senior VP - research analyst at Elara Capital.

Titan’s jewellery business growth moderated to a single digit after doubling in Q2 of FY22. But negating the high base effect, the three-year compounded annual growth rate (CAGR) in volumes is 12 percent.

D-Mart operator Avenue Supermarts reported 3-4 percent per-store revenue growth as general merchandise and apparel segments did not do “as well as expected.”

Outlook for FY24

The modest sales growth reported by discretionary companies came largely on the back of prices that were increased to offset high raw material costs and the trend of premiumisation in metro cities. For top line and bottom line to grow sustainably, sales have to be driven by higher demand and volumes, but that is a long road ahead, analysts said.

While the Street expects 15-18 percent EPS (earnings per share) growth for consumer discretionary companies, foreign brokerages CLSA and Jefferies have said they see downside risks to this number. In the consumer space, they prefer staples over discretionary.

Also Read: Consumer staples to outperform discretionary stocks in H2FY23, says CLSA

“There are concerns about further slowdown in discretionary and retail, especially after nearly two years of strong recovery and aggressive network expansion. FY24 will also see EPS growth converging for staples and discretionary stocks, with downside risk to estimates in discretionary,” according to Jefferies.

Discretionary stocks continue to trade at a premium to staples and their own history and are prone to further de-rating in 2023 if growth moderates, it added.

Challenges, budget

The downside risks are mainly low levels of disposable income and low penetration of discretionary goods in India.

“A slowdown in startup funding has driven job cuts in several cases, even as an increase in interest rates would lead to higher EMI outgo for households,” according to Jefferies. In addition, there are sector-specific challenges such as rising competition in the paints and consumer electronics segments.

The electronics industry also has to deal with high import duties on motors and components. Since January 1, ceiling fans have become 8-20 percent costlier because of new norms set by the Bureau of Energy Efficiency. This will further affect consumer affordability.

Also Read: Ceiling fans get costlier as BEE's revised norms mandate star labelling

The PHD Chamber of Commerce and Industry has pushed for an increase in consumption-led demand in Budget 2023 through a hike in per capita disposable income. This can be achieved by enhancing consumption expenditure rebate to Rs 5 lakh per annum, the Chamber said.

Some industry leaders are batting for the basic income tax exemption limit to be increased to Rs 5 lakh from Rs 2.5 lakh and enhancement of standard deduction of Rs 50,000 to about Rs 80,000.

The government is likely to continue with its thrust on initiatives such as Make in India and production-linked incentive schemes to boost local manufacturing and employment generation.

Also Read: Budget 2023: Here's a quick comparison of new vs existing income tax slabs

Companies are asking the government for a five-year extension in the Scheme for Promotion of Manufacturing of Electronic Components and Semiconductors with an increased outlay of Rs 10,000 crore in the Union Budget for FY24.

Rationalisation of goods and services tax rates is also on the wish list.

“We expect the government to look at categories like fans, which is a product of basic need and still being taxed at 18 percent. Mandatory star labelling norms have further led to price increases. We feel that the GST rate across energy efficient products should be reduced to help people switch to these products,” Rakesh Khanna, managing director of Orient Electric, told Moneycontrol.

Relief in import duties and input tax credits can help boost the health of the discretionary sector, said experts.

Disclaimer: The views and investment tips expressed by investment experts on Moneycontrol.com are their own and not those of the website or its management. Moneycontrol.com advises users to check with certified experts before taking any investment decisions.​​​​​​​​​​​​​",973,-0.27039999853480945
2023-01-09 11:07:00+05:30,https://www.moneycontrol.com/news/business/stocks/titan-shares-on-the-downhill-after-q3-growth-fails-to-meet-street-expectations-9831981.html,"live bse live

nse live Volume Todays L/H More ×

Shares of Titan opened lower on January 9 as the growth clocked by the company in October-December quarter failed to meet analyst expectations. The Street had forecast a growth of 17 percent on-year on the back of strong wedding season, while Titan reported 12 percent growth.

At 10:30am, the stock was quoting at Rs 2491.25, lower by 1.80 percent. It has gained 15 percent in the last six months.

Follow our live blog for market action

The maximum growth was recorded by Titan in its 'emerging businesses' category, where the sales shot up by 75 percent on-year. This includes fragrance and fashion accessories, and Indian dress wear sold under the Taneira brand.

The 'watches and wearables' segment registered a 14 percent growth. The jewellery business grew 11 percent on-year, with 22 new stores being added during the quarter.

A total of 111 new retail outlets were added in the quarter across businesses, taking the total count to 2,362.

Also Read: Titan Q3 business update: Combined sales jump 12% YoY, 111 new stores added

Foreign brokerage firm Morgan Stanley that has an Overweight rating on the stock, said: “The initial Q3 trends were slightly weaker than expected. The growth came on a high base of 36 percent in Q3FY22. Growth was slower in the second half of the year.”

Macquarie stated that the pace of store additions was also weaker than expected. In Q1FY23, the company had added 120 stores followed by 91 in Q2FY23.

However, the firm has an 'outperform' rating on the stock with target raised to Rs 3250 apiece largely on the back of resilience in Titan's consumer demand.

Disclaimer: The views and investment tips expressed by investment experts on Moneycontrol.com are their own and not those of the website or its management. Moneycontrol.com advises users to check with certified experts before taking any investment decisions.​​​​​",318,0.24989845603704453
2023-01-07 15:43:00+05:30,https://www.moneycontrol.com/news/business/helped-by-festive-sales-titan-reports-12-standalone-biz-growth-in-q3-9825981.html,"Titan Company

Leading jewellery and watchmaker Titan has recorded 12 per cent growth in its standalone business in the December quarter, led by ""healthy consumer demand"" spurred by a vibrant festive season.

""The positive consumer sentiment helped all categories clock healthy double-digit growths despite a high base in the same period of last year,"" as per the quarterly update by Titan for Q3 FY23.

The Tata group firm also continued network expansion by adding 111 stores in October-December, taking the total number to 2,362 at the end of the quarter.

During the quarter, Titan Jewellery, which generally contributes more than two-thirds of its revenue, achieved 11 per cent Y-O-Y growth.

""Healthy new buyer growths in the festive period, higher-value purchases in the studded category and unique new collections for the season helped the division achieve an 11 per cent growth YoY (excluding bullion sales),"" said Titan.

Sales from the studded category moderately outpaced the gold jewellery (plain) segment. Wedding sales grew in line with the division's overall sales, it noted.

As part of its global expansion, Titan opened its first international boutique store of Tanishq in New Jersey, US in December 2022.

""With this store opening, the international presence now spans 6 stores across Dubai, Abu Dhabi and the USA. The new store expansion (net) for the quarter consisted of 8 stores in Tanishq and 14 in Mia by Tanishq,"" it said.

Its 'Watches & Wearables' segment reported 14 per cent growth Y-o-Y. This was led by ""strong traction"" in the wearables space.

""A slew of exciting product launches in the fiscal year leading to the festive season contributed well to more than tripling sales from the wearables sub-segment in the quarter compared to the same period last year,"" it said.

In the eye care segment, the company said sales from Titan Eye+ stores and trade and distribution channel saw growth in-line with the overall division.

""EyeCare expanded its nationwide presence adding 36 new stores in Titan Eye+ (net) for the quarter,"" it said.

Fragrances and Fashion Accessories (F&FA) grew 39 per cent Y-o-Y. This was driven by 50 per cent growth in fragrances and around 21 per cent growth in fashion accessories, the update said.

Its Indian dress wear business Taneira expanded by 150 per cent Y-o-Y, driven by new store openings and healthy double-digit growth from existing stores.

""The customer response during the festive season was quite encouraging. The brand opened 5 new stores during the quarter, taking the total store count to 36 covering 17 cities pan-India,"" it said.",422,0.9980245729287466
2023-01-07 08:03:00+05:30,https://www.moneycontrol.com/news/business/titan-q3-business-update-combined-sales-jump-12-yoy-111-new-stores-added-9824071.html,"Titan had reported a 33% jump in net profit in Q2 FY23 (Representative image)

live bse live

nse live Volume Todays L/H More ×

Titan Company Ltd reported a 12 percent year-on-year (YoY) rise in its total sales, combined from all business categories, during the third quarter of the fiscal year 2022-23.

During the three-month period ending December 2022, the company also added a total of 111 new retail outlets, the company said in a stock exchange filing post market hours on January 6.

The maximum growth was recorded by Titan in its 'emerging businesses' category, where the sales shot up by 75 percent YoY. This includes fragrance and fashion accessories, and Indian dress wear sold under the Taneira brand. Five new stories, dealing with this category of business, were opened during the quarter, the company said.

The 'watches & wearables' segment registered a 14 percent growth. ""A slew of exciting product launches in the fiscal year leading to the festive season contributed well to more than tripling sales from the wearables sub-segment in the quarter compared to the same period last year,"" Titan said, adding that 48 new stores in this category of business were opened in Q3 FY23.

The jewellery business grew 11 percent on-year, with 22 new stories being added during the quarter. Wedding sales grew in line with the Division’s overall sales. Tanishq opened its first international boutique store in the USA, New Jersey in December 2022. With this store opening, the international presence now spans 6 stores across Dubai, Abu Dhabi and the USA,"" Titan said.

Sales from the eyecare business grew by 10 percent YoY, with the company adding 36 new Titan Eye+ stores in the October-December period.

In Q2 FY23, Titan had reported a 33 percent YoY growth in net profit to Rs 857 crore. The company's standalone revenue had grown by 21.8 percent on-year to Rs 8,730 crore.",316,0.999998790877206
2022-12-23 15:13:00+05:30,https://www.moneycontrol.com/news/technology/titan-talk-smartwatch-review-getting-the-basics-spot-on-9744201.html,"Titan recently launched a new smartwatch in India with its primary highlight being Bluetooth calling. Yes, the Titan Talk smartwatch packs a speaker and microphone that allows you to take calls directly from the watch so long as it is connected to a smartphone. The Titan Talk smartwatch’s price in India is set at Rs 9,995, and comes in blue, grey, gold and black colour schemes. After our brief period with the Titan Talk smartwatch, here’s our full review of the device.

Design

Our model of the Titan Talk BT calling smartwatch came in a black colour option with a black silicone strap that is easily replaceable and looks ordinary to say the least. The watch has a black aluminium case with the Titan logo on the left and two buttons on the right. The crown doubles as the back button and can be rotated to adjust volume. The other button brings up the workout menu.

The smartwatch features a 46mm dial that is protected by clear mineral glass. The 22mm silicone strap is quite comfortable and easy to replace if you want to swap it out for something more stylish. The watch also comes with an IP68 rating for water resistance. Overall, the Titan Talk smartwatch was comfortable to use and felt quite sturdy. While I couldn’t say the watch has a premium design and build, it is not too shabby either.

Display

For the display, Titan uses a 1.39-inch AMOLED panel with a pixel density of 462 PPI. The screen is quite bright and was easily readable under direct sunlight. Unfortunately, the display does not have an auto-brightness mode, while the touch response made the experience feel a little laggy, although this seems more like a software issue. Moreover, the display also has thick bezels that surround the dial. The smartwatch does have a ‘lift to wake’ mode, which works well for the most part.

Features

The Titan Talk smartwatch comes with 20 sports modes that can be easily accessed via the side button. While cycling, I found the watch accurately tracked calories burnt and covered various other metrics like average heart rate. You also get a breakdown of your activity showing the level of intensity during the workout. The Titan Talk smartwatch also monitors SpO2 or blood oxygen levels. It also supports sleep tracking, providing an overall score after breaking down sleep patterns into Deep Sleep, Light Sleep, REM and Awake.

Heart rate and sleep tracking was more or less in line with the results on the Apple Watch Series 8. There were inconsistencies with SpO2 monitoring and steps counted. Additionally, the lack of an in-built GPS also didn’t provide the distance covered while cycling or running. The Titan Talk smartwatch offers all the standard metrics and features of a regular smartwatch but doesn’t go above and beyond. Moreover, it loses out on the in-built GPS, stress monitoring and offers limited sports modes.

The Titan Talk can be paired with your smartphone using Bluetooth 5.1. The watch is pretty easy to set up and offers seamless connectivity. It can be used to make or receive calls thanks to its internal speaker and microphone. It also comes with CrystalVoice Technology, allowing you to take calls in marginally noisy environments. The microphone is positioned on the right of the dial and tends to struggle in open environments, particularly when there are vehicles around. I often struggled to get my message through to the person at the other end of the call.

I often struggled to get my message through to the person on the other end of the call. The new Titan Talk smartwatch also delivers notifications on time. Users can also take photos directly from the watch by opening the ‘camera’ option on the watch and then taping the Titan notification on your connected device. The watch also reminds you to drink water and offers breath exercises. You can also control music playback on the watch playing, pausing, forwarding, rewinding, and adjusting volume of the content playing on your connected device.

Software

The smartwatch can be paired with Titan’s Smart World app. The app is available for both Android and iOS and gives you detailed information about your workouts, sleep patterns, calories burnt, and more. You also have access to a global Titan community and a new ‘Reward’ system will be coming soon. There are 100 watch faces available for download from the app and you can also customise your watch face from pictures in your library. The watch also supports Google Assistant and a calculator.

You can also check the weather directly from the watch and there are two games installed, although I never got around to playing them. The smartwatch also has a music player that can load up to 50 songs locally. The smartwatch also has a ‘Find’ feature to locate your smartphone. Going back to the app, which allows you to turn on notifications and chose which apps you want to receive notifications from. Overall, the Titan Smart World app doesn’t provide a ton of data outside the watch, I think it could offer more in terms of activity statistics.

Battery

Titan’s Bluetooth calling smartwatch deliver solid battery life thanks to a 310 mAh cell. With all the watch’s tracking features turned on, including sleep tracking, working out for a couple of hours every day, water reminders, and doing some breathing exercises every now and then, we got around six days of battery life.

You can also use the Low power mode to extend the battery life to over a week. Titan has included a proprietary charger in the box, which attaches to the watch through pogo pins. The watch takes around two hours to hit a full charge. On balance, I think the battery life here is pretty solid on the Titan Talk watch.

Verdict

Titan takes a straightforward approach with its Talk BT Calling smartwatch. You get all the basic tracking features and solid battery life to help you live an active lifestyle. Additionally, the sleep tracking and SpO2 monitoring its pretty useful, while the watch is well-designed and doesn’t make any compromises with its build. And let’s not forget the Bluetooth calling that can be quite reliable in a jam and the bright vibrant AMOLED display. However, there are quite a few caveats here, including the lack of built-in GPS, limited sports modes, and the lacklustre interface.

The companion app also has limited features, and the third-party app support was quite poor. So should you buy the Titan Talk smartwatch? If you are looking for a good-looking smartwatch to live an active lifestyle, then the Titan Talk BT calling watch is worth considering. However, if you are a fitness enthusiast, there are quite a few options at this price that will offer more features and better tracking.",1136,0.3317738175392151
2022-12-20 12:13:00+05:30,https://www.moneycontrol.com/news/technology/titans-eye-care-brand-seeks-partners-to-achieve-greater-technological-edge-report-9734051.html,"Representative Image

To achieve a greater technological edge, watch maker Titan Co Limited’s eye care division is looking for partners for its eye care brand. The company plans to do so by either investing in entities that bring strong technical capabilities or acquiring them, a senior executive told Mint.

Saumen Bhaumik the chief executive of the eye-care division of Titan said the company is “open to"" any inorganic opportunities it may spot in the market.

Also Read: Titan case: Sebi disposed of show-cause notices against 58 individuals

Bhaumik emphasised on the company's desire for an investment with a technological orientation and said “Our exploration would be in the space which brings in a little bit of a tech orientation. As I said, this is an exploration. We’ll continue to explore whatever fits the scheme of things"".

Titan's eye care division operates the optical retail chain Titan Eye+, which sells prescription eyewear and lifestyle products under brands like Titan, Titan Glares and Fastrack.

Titan’s eye-care brand had an annual revenue of ₹517 crore in FY22. The chief executive also spoke at length about the division's expansion plans with a focus on expanding their reach in top 20 cities.

“We have expanded across 230-240 cities and towns; to that extent, we have deep penetration. We are going further, both deeper and wider, into the market. But the immediate focus will be on the top 20 cities because there are enough and more catchments that we have not yet covered,"" Bhaumik told Mint.

The company also plans to ramp up its local sourcing and is also attempting to build a vendor base in India while reducing its dependence on China.

“In 2019-second half, we realized that we are quite dependent on China. Before that, we made an investment in a frame factory. But business was by and large still going to China. Then, we had to change gear and we decided that we have to find an alternative to China. And even if it is not 100% made by us, there are other countries we would like to explore,"" Bhaumik said.

Talking about Titan's investment plans Bhaumik told Mint that the company plans to invest 20 crores in 2023.

“In FY23, another 20 crore is going in. Significant investment is happening but we are making sure the investment is balanced with capability building. There would be continued investment for another couple of years,"" Bhaumik said.",402,0.5054166913032532
2022-12-06 13:51:00+05:30,https://www.moneycontrol.com/news/business/stocks/consumer-staples-to-outperform-discretionary-stocks-in-h2fy23-says-clsa-9658051.html,"Representative image.

live bse live

nse live Volume Todays L/H More ×

Rebound in rural demand, easing inflationary pressures and recovery in margins bode well for consumer staple companies and could see them outperform discretionary stocks in H2FY23, foreign brokerage firm CLSA has said.

“We continue to see high base affecting growth for the discretionary names. On the other hand, staples stocks, on a low volume base in H2FY22 and with gradual easing in inflation, are placed well to report better earnings,” it said in a recent report.

Follow our live blog for all the market action

In the December quarter last year, HUL, Colgate and Marico reported low single-digit volume growth, while discretionary companies like Varun Beverages, Asian Paints and Titan clocked a volume growth upwards of 20 percent.

As rural markets account for nearly 69 percent of India’s population, staple companies are now pinning hopes on volume recovery backed by a good harvest, higher minimum support prices (MSP) and an increase in fertiliser subsidy, which will leave consumers with more money to spend.

Around 58 percent of the total 751 rural respondents noted improvement in income over pre-Covid levels, said CLSA, citing its proprietary survey. Rural demand has rebounded in October and companies are hopeful of the momentum sustaining.

Also Read: FMCG firms expect margins to improve as inflation eases

Discretionary companies, on the other hand, witnessed strong sales in October due to the festival season but the demand tapered off in November, the foreign brokerage firm said. “Discretionary companies are cautious on demand momentum,” it added.

CLSA’s preferred picks in consumer staples are Hindustan Unilever with a target price of Rs 2,950, Dabur with a target of Rs 625 and ITC Rs 375.

From August to November, ITC gained 10.6 percent, HUL 3.52 percent, Godrej Consumer was up 2.3 percent and Dabur gained 1.3 percent. Consumer discretionary stocks also gained in the same period. Varun Beverages was up 35 percent, Titan 11.7 percent and Pidilite gained 10 percent.

Disclaimer: The views and investment tips expressed by experts on Moneycontrol.com are their own and not those of the website or its management. Moneycontrol.com advises users to check with certified experts before taking any investment decisions.​​​",367,0.5544183775782585
