Date,link,text
"November 09, 2023 05:43 PM IST",https://www.moneycontrol.com/news/business/earnings/airtel-payments-bank-net-profit-rises-to-rs-7-7-crore-in-q2-11710871.html,"Airtel Payments Bank net profit rises to Rs 7.7 crore in Q2

Airtel Payments Bank on Thursday posted a multifold jump in net profit to Rs 7.7 crore in the September quarter mainly on account of uptick in saving accounts. The company, which is the only profitable payments bank, had posted a profit of Rs 3 crore in the year-ago period.

The revenue of Airtel Payments Bank grew 39 per cent on a year-on-year basis to Rs 427 crore during the reported quarter. The bank's Monthly Transacting Users (MTUs) grew to Rs 5.8 crore, giving a boost to customer deposits, which grew 52 per cent year-on-year to Rs 2,060 crore, Airtel Payments Bank said in a statement.

""The growth in revenue and MTUs is driven primarily by an uptick in the bank's savings bank accounts,"" the statement said. The bank's annualised gross merchandise value stands at over Rs 2,50,000 crore.

""The success we have attained reaffirms the viability of the payments bank model, underscoring its pivotal role in addressing the digital and financial inclusion needs of India. We are well poised for a sustained growth and we remain committed to advancing our reach,"" Airtel Payments Bank MD and CEO Anubrata Biswas said."
"November 03, 2023 11:00 PM IST",https://www.moneycontrol.com/news/business/companies/airtel-digital-head-adarsh-nair-quits-11661741.html,"Airtel Digital head Adarsh Nair has resigned from the company after a five-year stint, according to a regulatory filing.

Nair joined Airtel five years ago and was elevated to the position of Director of Airtel Digital about four months back. ""We wish to inform you that Mr Adarsh Nair, Chief Product Officer of the company has resigned and accordingly, ceases to be a Senior Management Personnel. His resignation has been accepted on November 3, 2023 and will be relieved from his duties upon closure of business hours on February 15,"" the filing said on Friday.

While the regulatory filing mentioned his designation as chief product officer, the company's website mentioned it as director of Airtel Digital where he was responsible for Airtel ads, Airtel IQ, Wynk Music, and Xstream Video. According to his resignation letter, he has put in his papers citing his plan to relocate back to the US early next year."
"November 01, 2023 07:11 PM IST",https://www.moneycontrol.com/news/business/tariffs-need-to-go-up-industry-should-become-viable-airtel-ceo-11645651.html,"Tariffs need to go up; industry should become viable: Airtel CEO

Telecom tariffs in India are low and need to go up, Bharti Airtel CEO Gopal Vittal said on November 1, asserting that the industry needs to become viable. The Airtel top honcho described 5G as a ""long haul"" where use cases are still evolving globally, and made it clear that the company is not in any race to beat its drum on having the largest, fastest rollout, but instead is sharply focused on delivering good experience for its 5G customers.

He said Airtel does not believe in higher 5G tariff, but will continue to strive for overall hike in tariffs, while keeping the service most affordable and high quality. ""We also understand that the needs of different segments of customers and really don't believe in one-size-fits-all.

""For the telecom industry to continue to invest and deliver the digital vision of India, the industry needs to be viable and cross subsidisation, therefore or using the power of the balance sheet is not a sustainable proposition at the end,"" Vittal said at the Q2 earnings call. Vibrant competition, affordable tariffs, and financial viability of the industry can all go hand in hand, he said.

To a question on timing and possible extent of any tariff hike, Vittal noted that tariffs are low in India. ""…this is not all in our hands, tariffs are very low in India, both the average revenue per user as well as rate per GB. If you plot both of those on two axis, then we are right at the bottom on both,"" he said, adding that tariffs do need to go up, and the industry needs to become viable.

""But it is not at all in our hands. I would say just say wait and watch. The question is not whether it will happen, it is when it will happen. We've already seen two rounds of tariff increase since the launch of Reliance Jio, and hopefully it will happen at some stage, not in the distant future,"" he said, while declining to commit to specific timelines. On 5G, he said the challenge right now is that the ""real"" use case on 5G today is ""only speed"".

""So on the small device that you carry in your pocket, you may get 400-500 Mbps speeds… but the fact is for the applications that you use on that device, typically messaging or video or email, you really don't need more than 4-7 Mbps speeds. ""So users are actually oblivious of whether they have 5G or 4G, they are looking for a good data experience,"" he said.

More applications have to be on 5G, harnessing the true power of the fifth generation technology, he said. ""You need more applications to be written on 5G networks, which really use the benefit of this technology which, unfortunately, is not the case… not just in India, but in no market anywhere,"" Vittal said.

Except for some private 5G networks, and specific B2B use cases, which have modest revenue streams associated with it, the fundamental use cases for 5G ""are still not there"". ""That said, I think the reason 5G usage is today much higher… is simply because it's free. So the data is corrupted by the fact that it is free… if it is not free, then the real usage is what we will be able to study,"" he said.

India's second largest telecom operator Bharti Airtel on Tuesday reported a 37.5 per cent year-on-year fall in consolidated net profit to Rs 1,341 crore for the September quarter, weighed down by one-time exceptional charge. Bharti Airtel, which competes in the market with Reliance Jio and Vodafone Idea, saw its September quarter revenue climb 7.3 per cent year-on-year to Rs 37,044 crore ""backed by strong and consistent performance in India operations"".

Net income (after exceptional items) at about Rs 1,341 crore, was 37.5 per cent lower than the year-ago period."
"October 27, 2023 12:42 PM IST",https://www.moneycontrol.com/news/business/india-mobile-congress-not-just-5g-india-is-working-on-becoming-leader-in-6g-says-pm-modi-11611261.html,"PM Modi said that since 5G was rolled out, over 4 lakh 5G base stations have been established, covering 97% of the nation.

India is not only concentrating on the deployment of 5G but is also working to become a leader in 6G technology, Prime Minister Narendra Modi said on October 27.

Modi, who spoke on the first day of the 7th edition of the India Mobile Congress, said this while inaugurating 100 5G labs spread across the entire country.

""These labs will help youngsters in dreaming big and aid them in realising these dreams,"" Modi said.

""When I was going through the stalls at the exhibition, I saw a glimpse of our future in terms of 6G, cybersecurity, drone, space sector, green tech and so on,"" Modi said.

Modi said that since 5G was rolled out, over 4 lakh 5G base stations have been established, covering 97% of the nation.

Internet speed

The prime minister also noted that due to 5G, broadband speed in India has increased 3 times.

""Improving internet speeds helps in ease of living. Teachers can connect better with their students. Doctors with patients,"" Modi said.

Modi also said that 2 lakh gram panchayats have been connected with broadband through the BharatNet programme.

Electronics manufacturing

The prime minister also addressed electronics manufacturing and the enhancement of the semiconductor ecosystem in the country, stating,"" Before 2014, India's government was akin to smartphones which used to hang when someone touched the screen. We stopped using outdated phones in 2014. Earlier we were importers of mobile phones. Now we are exporters.""

""Google will be making its Pixel phones in India. Samsung and Apple phones (iPhone 15) are already being made. Entire world is now using made in India phones,"" he added.

Reliance Jio and Airtel on 5G

Chairman of Reliance Jio Infocomm Limited, Akash Ambani, praised PM Modi for leading the digital connectivity revolution to connect 1.4 billion Indians.

""Last year you challenged us to make India a global leader in 5G. What we have achieved is stunning. Jio had the fastest rollout of 5G,"" he said.

Ambani also said that, just as PM Modi has established the Statue of Unity, the world's largest statue, he will be working on unveiling the Digital Statue of Unity.

Chairperson of Bharti Airtel, Sunil Bharti Mittal, said that Airtel 5G is now in 5,000 towns and 20,000 villages.

""By March 2024, Airtel will have covered the entire country with 5G,"" he added.

Mittal also said that the satellite communication (satcom) services of OneWeb, in which Bharti Airtel has the largest stake, will be available for use from next month onwards. A ground satellite station has been installed in Mehsana, Gujarat."
"October 22, 2023 07:02 AM IST",https://www.moneycontrol.com/news/business/india-leaves-europe-behind-in-5g-network-expansion-11578861.html,"The ITU Study Group, a United Nations organisation, met in Geneva earlier this month and supported India's goal of having widespread 6G coverage.

In a LinkedIn post on October 21, Ivan Razon, who is Vice President of Strategy and Corporate Affairs at Ericsson, emphasized the remarkable expansion of 5G in India during the period between May 2022 and August 2023. He stated that India has made remarkable progress in 5G Standalone availability, while Europe lags behind.

Ericsson executive's comments coincide with a period in which India has achieved significant progress in the deployment of 5G networks. Telecom companies in India have been extending their network coverage to provide swifter and more dependable connectivity to both consumers and businesses throughout the country.

India's 5G achievements earns praise from Nokia CEO

At the beginning of this month, Pekka Lundmark, President and CEO of Nokia, acknowledged that India's 5G network deployment has been remarkable, placing the country among the top three nations globally with the largest 5G user base. Additionally, Lundmark noted that 5G download speeds in India surpass those in numerous advanced markets. And, a recent Ericsson survey revealed that an estimated 31 million users in India are expected to upgrade to 5G-enabled phones in 2023. According to the report, the introduction of 5G has resulted in a 30% increase in overall network satisfaction in India compared to the previous 4G technology. Also, earlier this month, Nokia launched 6G Lab as a project to accelerate the development of fundamental technologies and ground-breaking applications based on 6G technology.

The ITU Study Group, a United Nations organisation, met in Geneva earlier this month and supported India's goal of having widespread 6G coverage. It is expected that this choice would result in cheaper implementation costs for the next generation of technology.

5G user base hits 1.3 bn worldwide with India at the forefront of growth

As per a recent report, 5G subscriptions experienced a substantial increase of 175 million in Q2 2023, reaching a global total of 1.3 billion users. India emerged as the largest contributor, adding over 7 million users to this figure.

Furthermore, mobile broadband subscriptions saw a notable growth of 100 million during the same quarter, reaching a total of 7.4 billion worldwide. Mobile broadband now constitutes 88 percent of all subscriptions. Examining mobile subscription penetration by country, India accounted for an impressive 79 percent.

PM Modi launched 5G Services at Indian Mobile Congress 2022

Prime Minister Narendra Modi inaugurated the 5G services in India during the Indian Mobile Congress (IMC) 2022 held in Delhi on October 1, 2022. On the same momentous day, Bharti Airtel launched 5G services in eight cities, which included the four major metropolitan areas. Sunil Bharti Mittal, the Chairman of Bharti Airtel, made a commitment to provide nationwide 5G coverage by March 2024. Simultaneously, Reliance Industries unveiled their ambitious plans for a nationwide 5G rollout through their subsidiary company, Reliance Jio Infocomm Limited, utilizing the 26 GHz mm-wave spectrum on August 14.

Reliance Jio and Bharti Airtel to invest Rs 75,000 crore in network enhancement

Reliance Jio and Bharti Airtel are expected to invest about Rs 75,000 crore in the current financial year to strengthen their networks, according to a report by JM Financial. According to the report, Jio may invest around Rs 42,000 crore and Bharti Airtel around Rs 33,000 crore in FY24.

Disclaimer: Moneycontrol is a part of the Network18 group. Network18 is controlled by Independent Media Trust, of which Reliance Industries is the sole beneficiary."
"October 19, 2023 11:35 PM IST",https://www.moneycontrol.com/news/business/airtel-ericsson-test-new-tech-that-claims-to-save-devices-battery-on-5g-network-11567191.html,"Ericsson RedCap is a new radio access network (RAN) software solution that creates new 5G use cases and enables more 5G connections from devices.

Bharti Airtel and Ericsson have tested a new technology that claims to save battery of devices on 5G network, the telecom gear maker said on Thursday. Ercisson claimed that its Reduced Capability (RedCap) solution will bring down complexity and extend the battery life of devices while delivering higher data rates.

""The successful testing of RedCap technology on our network will enable futuristic IoT broadband adoption for devices including wearables and industrial sensors in a way that is both cost and energy efficient. RedCap’s broader applicability will further our innovation agenda to bring out newer applications for consumers, industries and enterprises,"" Bharti Airtel CTO Randeep Sekhon said. Ericsson RedCap is a new radio access network (RAN) software solution that creates new 5G use cases and enables more 5G connections from devices such as smartwatches, other wearables, and industrial sensors and augmented and virtual reality devices.

""With our customers like Airtel continuously investing in network capabilities to seize the opportunities offered by 5G, the commercialization of RedCap capabilities will enable them to grow their consumer business and enable new industry applications,"" said Sandeep Hingorani, head of network solutions for customer unit Bharti at Ericsson."
"October 18, 2023 10:47 PM IST",https://www.moneycontrol.com/news/business/airtel-sees-rs-8000-crore-market-opportunity-with-ccaas-cloud-platform-launch-11558581.html,"Airtel sees Rs 8,000 crore market opportunity with CCaaS cloud platform launch

Telecom operator Bharti Airtel has launched Contact Center as a Service, which it claims to be the industry's first omnichannel cloud platform, to tap into about Rs 8,000 crore market opportunity in the country. Airtel said businesses with contact centre requirements need to source voice, cloud and software separately from multiple vendors at present, resulting in higher capital and time investments.

""Airtel's innovative CCaaS offering will enable enterprises to reduce these investments significantly, as the platform unifies Voice-as-a-service (VaaS), cloud and the best of contact centre software from leading providers, including Genesys. The platform will enable enterprises to get started on contact centre solutions instantly at affordable monthly costs,"" Airtel said in a statement. An Airtel spokesperson said voice is Rs 4,000 crore, and the overall contact centre market will be more than twice the voice market.

Airtel Business, Head for Digital Products and Services, Abhishek Biswal said the lack of a unified platform for contact centre solutions has been an industry issue. ""Our CCaaS offering combines the best of voice, cloud and software to simplify contact centre management at an affordable cost. With this, we will not only revolutionise the segment with a game-changing solution but will also usher in a new era of streamlined operations,"" Biswal said.

Airtel said that the platform also eliminates the need for enterprises to close requisite regulatory compliances and the challenge of longer wait time during troubleshooting requirements, which not only involve higher capital, operational expenses and time investments but also limits easy scaling to other locations."
"October 16, 2023 02:42 PM IST",https://www.moneycontrol.com/news/trends/legal/sc-rejects-telcos-plea-of-licence-fee-be-treated-as-revenue-expenditure-puts-an-end-to-decade-old-litigation-11540531.html,"SC upholds tax department plea against telcos

The Supreme Court on October 16 held that the licence fee paid by telecommunication companies such as Bharti Airtel, Vodafone Idea post July 1999 to be treated as capital expenditure and not revenue expenditure.

The apex court accepted Income Tax Department's contention that since the annual payment based on Adjusted Gross Revenue is again only towards License fees and merely because it is paid based on the annual gross revenue the payment cannot be construed as revenue expenditure.

The SC has put an end to a decade-old litigation between the income tax department and the telecommunication companies with this litigation. Earlier Delhi High Court had held that the expenditure cannot be construed as capital expenditure since license fee is paid as a part of the revenue as per the AGR scheme.

This is a developing story. Please check back for more updates"
"September 04, 2023 03:33 PM IST",https://www.moneycontrol.com/news/business/bharti-airtel-to-source-23000-mwh-of-renewable-energy-for-6-nxtra-data-centers-11307831.html,"These projects will supply power to six of Nxtra's Edge data center facilities.

live bse live

nse live Volume Todays L/H More ×

Bharti Airtel said on September 4 that it will procure 23,000 MWh of renewable energy for its data center subsidiary, Nxtra, by the fourth quarter of the current fiscal year 2023-2024, with an aim to reduce its carbon footprint.

Airtel will invest in renewable energy projects developed by Continuum Green India Pvt. Ltd. and Vibrant Energy Holdings Pte. Ltd, which will supply power to six of Nxtra's Edge data center facilities.

Airtel plans to acquire renewable energy through an open access route, involving stakes in Continuum Green's project company, which will provide environmentally friendly power generated from solar and wind projects to its Edge data centers located in Madhya Pradesh. Additionally, Airtel has also entered into a similar agreement with Vibrant Energy's project company to supply solar power to its Edge data center in Vijaywada. These new additions will bring the total contracted renewable energy capacity for Nxtra data centers to over 274,000 MWh.

ALSO READ: Bharti Airtel's Nxtra to become first data center company in India to install Fuel Cell Technology

While commenting on the deal, Ashish Arora, CEO - Nxtra by Airtel, said: “As a leader in India’s data center industry, Nxtra is committed to become a Net Zero Company by 2031. We believe that India’s growth will be mirrored by its Data Center industry growth in the coming years and are committed to reduce our carbon footprint and lead the Green Data Center infrastructure revolution in the country,"" he said."
"August 24, 2023 08:23 PM IST",https://www.moneycontrol.com/news/telecom/jio-airtel-drive-telecom-subs-base-in-india-rose-to-1173-89-mn-in-june-11253111.html,"The net addition in wireless subscribers of telecom operators in the month of June was 3,73,602.

Telecom subscriber base in the country grew marginally to 1,173.89 million at the end of June on account of new customer additions led by Reliance Jio, sector regulator Trai said on Thursday.

The subscriber base growth was driven by mobile telephony where Reliance Jio added over 2.27 million new customers and Bharti Airtel added 1.4 million customers. ""The number of telephone subscribers in India increased from 1,172.57 million at the end of May-23 to 1,173.89 million at the end of June-23, thereby showing a monthly growth rate of 0.11 per cent,"" the Telecom Regulatory Authority of India (Trai) said in its monthly subscriber report.

However, the overall growth was mitigated by the loss of subscribers by state-owned BSNL, MTNL and Vodafone Idea (VIL). BSNL lost 1.87 million mobile subscribers, VIL lost 1.28 million subscribers and MTNL (1,52,912 subscribers). The net addition in wireless subscribers of telecom operators in the month of June was 3,73,602. ""Total wireless subscribers increased from 1,143.21 million at the end of May-23, to 1,143.58 million at the end of June-23, thereby registering a monthly growth rate of 0.03 per cent,"" Trai said.

After a marginal decline in May, wireline connections increased in June. The growth in the wireline segment was led by APFPL which added 6,56,424 new connections. It was followed by Reliance Jio with the addition of 2,08,014 connections, Bharti Airtel (1,34,021), V-Con Mobile and Infra (13,100), Tata Teleservices (12,617) and Quadrant added 6,540 connections in June.

The total broadband subscribers increased to 861.47 million at the end of June 2023 from 856.81 million at the end of May with a monthly growth rate of 0.54 per cent, the report said. ""Top five service providers constituted 98.37 per cent market share of the total broadband subscribers at the end of June-23. These service providers were Reliance Jio Infocomm Ltd 447.75 million, Bharti Airtel 248.06 million, Vodafone Idea 124.90 million, BSNL 24.59 million and Atria Convergence 2.16 million,' the report said."
"August 03, 2023 06:36 PM IST",https://www.moneycontrol.com/news/india/moneycontrol-selects-top-stories-this-evening-439-11092851.html,"A round-up of the big stories

Here is a collection of the most important stories this evening:

Bharti Airtel Q1 results: Net profit flat at Rs 1,612 crore; ARPU at Rs 200

Bharti Airtel on August 3 reported a consolidated net profit of Rs 1,612.5 crore in the first quarter of the current financial year, up 0.34 percent from the year-ago period. Read more

Bank of England hikes key interest rate by 25 bps to 15-year high to fight inflation

The Bank of England raised its main interest rate on August 3 by 25 bps to a fresh 15-year high as it tries to bring down persistently high inflation. Read more

Nifty ends the day below 19,400, buy-on-dips pushes Sensex close to 65,250

Indian equities remained under pressure on August 3 amid weak global cues. Selling was seen across the board and broader markets, which showed some resilience in the morning, also crumbled under the pressure. Towards the end of the day, once again dips were bought into. Read more

Moneycontrol Selects

Adani Enterprises Q1 results: Net profit up 44% at Rs 674 cr, revenue down 38%

Adani Enterprises on August 3 reported a consolidated net profit of Rs 674 crore for the quarter ended June 2023, rising 44 percent over Rs 469 crore reported last fiscal. Read more

Zomato posts surprise profit of Rs 2 crore in Q1, revenue rises 71% to Rs 2,416 crore

Zomato on August 3 posted a net profit of Rs 2 crore in the first quarter of the current financial year and reported revenues of Rs 2,416 crore, up 70.9 percent from the year-ago period, as demand growth recovered on cooling inflation and strength of the food delivery platform’s loyalty programme. Read more

Three IPOs to hit Dalal Street tomorrow, total fund raising over Rs 1,600 crore

The market will see three IPOs opening for subscription on the last day of the week on August 4. The total fund raising by them would be more than Rs 1,600 crore. Read more

DPDP bill: Govt proposes Rs 25 crore one-time expense to set up Data Protection Board, annual expenditure of Rs 10 crore

The Digital Personal Data Protection (DPDP) bill, tabled in the Parliament on August 3, proposed a one-time expenditure of Rs 25 crore to set up a Data Protection Board and a recurring expenditure of Rs 10 crore annually for its functioning. Read more"
"August 01, 2023 11:25 PM IST",https://www.moneycontrol.com/news/business/companies/airtel-to-target-small-and-medium-businesses-market-with-airtel-iq-messaging-platform-11076971.html,"Telecom operator Bharti Airtel is looking to garner a major share in enterprise communication services segment of small and medium businesses with its new Airtel IQ Reach platform, a senior company official said on Tuesday. Airtel's communications platform as a service (CPaas) Airtel IQ Reach will enable small and medium businesses to engage with target customers with prepaid pay-as-you-go plans.

""About 20-25 percent of target message market is small and medium businesses for promotion. That is the market which we would like to go after and be market leaders in terms of message volumes,"" Airtel Business, Head Digital Products & Services, Abhishek Biswal said.

He said that Airtel IQ subscribers will need to spend Rs 10,000 to Rs 1.5 lakh per month to avail the service.

It is a prepaid self-serve platform which will enable businesses to send personalised communications to pre-defined customer segments."
