Date,link,text
"March 16, 2016 05:20 PM IST",https://www.moneycontrol.com/news/business/companies/about-81k-complaints-against-telcos2015-prasad-1029025.html,"live bse live

nse live Volume Todays L/H More ×

Complaints against mobile service providers have increased to 80,947 last year, up from 68,691 in 2014, government said today.

Telecom Minister Ravi Shankar Prasad said the Department of Telecom (DoT) received 57,634 complaints in 2015 compared with 50,197 in the previous year.

Meanwhile, complaints received by telecom regulator Trai increased to 23,313 last year, as against 18,494 in 2014.

The minister was replying to a question if there is an increase in the number of consumers' complaints about bills, connectivity, mobile portability, harassment and so on against the mobile service providers.

""There is slight increase in consumer complaints against few mobile service providers,"" Prasad said in a written reply to Lok Sabha.

According to data shared by the minister, there is an increase in complaints received by DoT against operators like Airtel, BSNL, MTS and Videocon. However, complaints against Idea, MTNL, Reliance, Tata, Uninor and Vodafone have declined.

Complaints received by Telecom Regulatory Authority of India (Trai) against all telcos, barring Tata and Uninor, have increased.

On action taken by government, Prasad said complaints received by DoT and Trai are being forwarded to concerned service providers for their resolution.

""For effective resolution of consumer complaints, Trai has laid down the standards of quality of service parameters relating to time limit for fault repair, billing complaints, refund of security deposits and rent rebate for delayed fault repair,"" he said.

Trai has been monitoring the performance of service providers against the benchmarks for these parameters through quarterly performance monitoring reports submitted by the service providers, the minister said.

""Wherever the quality of service benchmark is not met, financial disincentives are imposed so that the service providers improve their performance,"" he said.

The minister said Trai has issued Telecommunication Mobile Number Portability (Fourth Amendment) Regulations, 2012, providing financial disincentives for unjustified rejection of porting request and for violation of timeline specified in the regulations.

""Government PSUs (BSNL/MTNL) are using social media for receiving complaints and suggestions from customers for better customer satisfaction,"" Prasad added."
"February 10, 2016 10:23 PM IST",https://www.moneycontrol.com/news/business/companies/telenor-to-take-final-callspectrum-auction-after-pricing-1041693.html,"Norwegian telecom firm Telenor on Wednesday said it may participate in the next round of spectrum auction but will take its final call only after the government decides on the pricing. The company will also explore option of buying or sharing airwaves for wireless services with other telecom operators under spectrum trading and sharing rule as it looks to boost its operations in India, Telenor Group President & CEO Sigve Brekke said.""The future of our Indian operations will depend on additional spectrum. There is a planned auction coming in May-June and we are going to have a pragmatic and prudent way of looking at that as an opportunity,"" Brekke said during the webcast of Telenor Group financial report. The Telecom Regulator Authority of India has recommended spectrum pricing for seven bands, including the premium 700 Mhz frequency at record base price of Rs 11,485 crore per Mhz, for the next round of auction which could fetch the government a staggering Rs 5.36 lakh crore. ""What I have seen from regulator and prices so far is that they are planning to put a lot of spectrum on auction. Prices for lower band is good too high, however price for higher band such as 2.3 Ghz is more reasonable,"" Brekke said. Trai has recommended a base price of Rs 817 crore per Mhz on pan-India basis for 2.3 Ghz band. Telenor was one of the companies that strongly advocated for auction of 700 Mhz band while leading telecom players - Airtel, Idea, Reliance Jio - suggested to defer it.

""We will look at this once the spectrum prices are decided but we are going to take very pragmatic and prudent approach. We will also look at other possibilities such as spectrum sharing and trading which is now allowed,"" Brekke said. Telenor India's operating loss widened to Rs 460 crore or 368 million Norwegian krone (NOK) for the fourth quarter ended December 31, 2015 from operating loss was Rs 358.53 crore during the same period a year ago.

For the year ended December 2015, the operating loss of Telenor India stood at Rs 1,236.75 crore. ""I also want to make it clear that if we cannot justify the spectrum prices going forward then we will have figure out all the other alternatives,"" Brekke said. Average revenue per user (ARPU) of Telenor India in local currency fell by 13 per cent to Rs 88 primarily driven by lower voice consumption and the impact from reduced mobile termination rate, partly compensated by increased data usage.

""The whole is market is now turning from voice into data and that is the reason we see little pressure on ARPU however our India operations are holding up quite nicely,"" Brekke said. Telenor India's quarterly revenue increased by 21 per cent on year-on-year basis and annual revenue by 33 percent."
"February 06, 2016 02:57 PM IST",https://www.moneycontrol.com/news/trends/current-affairs/telcos-to-contest-trai-viewsauction-pricing-before-dot-1043163.html,"Telecom operators will approach DoT to contest Trai's recommendations on spectrum auctions, especially on pricing of the premium 700 Mhz band. ""We will write to DoT by the end of next week for deferring auction of 700 Mhz band and on possible errors in calculation of price of 700 Mhz band (spectrum). Trai has fixed priced based on formula given 2012. Lot of things in the industry have changed since then,"" COAI Director General Rajan S Mathews told PTI. Leading operators had requested the regulator to defer sale of 700 MHz spectrum, saying that ecosystem for providing services in this band was not developed and sale would lead to under-utilisation of the spectrum for several years and block industry's crucial fund. The Telecom Regulatory Authority of India has recommended a record high base price of Rs 11,485 crore per Mhz for 700 Mhz which alone.

If all the available frequencies gets sold at Trai suggested price then it alone will yield a whopping Rs 4 lakh crore. As per Trai's paper, the cost of delivering mobile services in 700 Mhz band is approximately 70 percent lower than 2100 Mhz band, which is widely used for 3G services. The auction plan suggested by total potential revenue of Rs 5.36 lakh crore from the spectrum sale, expected to be held during May-June this year, is more than the double of gross revenues of telecom services industry.

Telecom service providers had gross revenue of Rs 2.54 lakh crore in 2014-15 financial year. Trai has used its old formula given in April 2012 spectrum price recommendation to fix price of 700 Mhz at four times of 1800 Mhz band spectrum price -- widely known as 2G spectrum. Most of telecom operators who have purchased 1800 Mhz band in 2012 or later are using it for 4G services.

Mathews said that Cellular Operators Association of India (COAI) also has objections on Trai's suggestion to reduce block size in 2300 Mhz band and 2500 Mhz band to 10 Mhz while in 2010 telecom operators like Infotel Broadband (now Reliance Jio), Airtel and Aircel were allowed to buy block of 20 Mhz. ""Government should give everyone equal opportunity. Across the world 20 Mhz block is a standard so it should be same in India,"" Mathews said.

Telecom operators will also raise issue of contiguous spectrum frequency in 1800 Mhz band. ""A contiguous spectrum will not only bring value for industry but also fetch good price in auctions,"" Mathews said. While DoT has proposed to auction 21 Mhz of radiowave frequencies in 1800 Mhz band, Trai has suggested that on completion of harmonisation with Defence it can increase to 201 Mhz spectrum in the same band."
"January 22, 2016 06:25 PM IST",https://www.moneycontrol.com/news/business/wire-news/dr-jawahar-surisetti-createsecosystem-for-girl-child-education-1048200.html,"Business Wire IndiaIn a grand function held at Goa under the aegis of National Quality Awards last weekend, India's first Miss Universe Sushmita Sen felicitated Dr Jawahar Surisetti for his project ""My Beti, My Life"" at Cidade de Goa for extraordinary service to women and girl empowerment.

Dr Jawahar Surisetti is a well-known educationist and psychologist in India, who has been awarded by the U.S. State and the Indian Government many times earlier for his projects of social education for the disadvantaged children of the interiors of India. He runs Corporate Social Responsibility projects of Tata Steel, JK Lakshmi Cements, Airtel and many other corporates by extending his expertise to reach out to the last person of the society.

During one such visits of the World Bank and UN to the tribal areas of Chhattisgarh, he had witnessed that there were a large number of girls dropping out of school in Grade 7. A study was commissioned to find out the reasons and it was found that there were multiple reasons for the increased dropout. During their periods, girls were finding it difficult to go to the toilet because there were no separate girls toilets in schools. Second was the non-availability of clean water in schools and third was the lack of facilities for disposal of rags and pads in schools. A report was submitted to the Government of India out of which the separate girls toilets issue has been actively engaged by Prime Minister Narendra Modi.

During this study, it was found that girls in these backward areas used rags, gunny bags, and ash during their periods as a replacement of sanitary napkins. These dirty material being used was hazardous and in some cases cancerous to the health of these girls. Dr Jawahar Surisetti then decided to start MyBeti which would supply sanitary napkins free of cost to these girls through a network of lady teachers in government schools. The aim was to bring back these girls to schools. A major napkin manufacturing company supported this cause by supplying 10 million napkins to MyBeti. Currently, 1 lakh girls are being supplied with these napkins free of cost.

The ultimate aim of Dr Jawahar is to create an ecosystem wherein the local women self-help groups are trained to manufacture clean and hygienic napkins to cater to these local schools. These are bought by the government or district administration and supplied to local schools creating employment for these ladies and reducing costs for the government while the purpose of the girl child is solved. This is the second phase of the project.

Dr Jawahar wishes that apart from his efforts, the whole community comes forward in getting toilets for girls and clean water in schools and create a disposal system for the sanitary napkins in schools. All these efforts could bring girls in large numbers back to school with the confidence that the society is with them.

Photo Caption: My Beti felicitated for women empowerment by Sushmita Sen"
"January 14, 2016 10:25 PM IST",https://www.moneycontrol.com/news/business/companies/telcos-responsedifferential-pricing-vague-mp-chandrasekhar-1050326.html,"live bse live

nse live Volume Todays L/H More ×

Telecom operators' response to Trai's paper on differential pricing for data services is ""vague"" and their claims with regard to level-playing field are ""irrelevant"", Member of Parliament, Rajeev Chandrasekhar has said while opposing any such move. ""This consultation is examining the issue of Differential Pricing for Data Services. At the very outset, it must be said that the vague responses and claims made by Telcos with regard to 'Level Playing Field' are irrelevant to this question and can be ignored,"" Chandrasekhar submitted to Trai in counter comments.

Trai invited public comments to firm up its views over services that lead to differential pricing of data and today was the last date for submitting counter comments on the same. Telecom operators including Airtel, Vodafone, Idea, Reliance Communications and their respective associations have supported differential pricing for data services, while Internet service providers have opposed the plan. Software Freedom Law Centre said that VoIP services or internet based calls compete with traditional telephone services, as they should, because all communications, whether characterized as ""telephone calls"" or ""data packets"" are in fact the same.

""What other commentators call ""price arbitrage"" by consumers between these services should be called ""user efforts to eliminate anti-competitive routing practices, otherwise known as ""net neutrality"", SFLC said. Chandrasekhar said telecom operators claim regarding the threat to their viability contradicts all available evidence in their quarterly financial reports which point to significant revenue growth. ""Their (telecom operators) call for Differential Pricing is with a view to ensure that they are permitted to cabalize the internet through gatekeeping.

The need for a free, open and fair internet, however must supersede this desire of telcos to misuse control, and increase profits,"" he added. Chandrasekhar said that'cabalization' of the internet causes vertical integration which would lead to telecom operators owning parts of the internet and impacting consumer choice and competition in the long term by making web-only entities unviable and unable to compete. A debate on net neutrality stirred across the country after Airtel decided to charge separately for Internet-based calls but withdrew it later after people protested.

Airtel in its comment to Trai again submitted to allow companies levy different charge on internet when it is used for making calls. ""For the growth of data service, price differentiation for data services can be allowed,"" operators have submitted."
"December 14, 2015 10:20 AM IST",https://www.moneycontrol.com/news/business/wire-news/rideyogi-brings-assured-qualitytransparent-buying-process-for-people-seeking-to-purchase-used-bikes-1471579.html,"Business Wire IndiaRideyogi.com - a premier bazaar for inspected used bikes and scooters founded by Airtel & Hero Motorcycles Alumni, has launched a free 1 year Warranty program for all customers purchasing any two-wheeler through its web portal.



On Rideyogi, used bikes are listed only after a detailed inspection on over 150+ technical parameters by experienced automobile engineers and the verified seller contact details are directly shared with the prospective buyer on the portal, thus earning the trust of the prospective buyer by ensuring quality and transparency.



Existing Classified Models don't offer any quality assurance to buyers as the actual product and seller details aren't verified. Also, existing marketplaces for two-wheelers don't offer transparency as prices are fixed and seller details are concealed from the buyer.



Rideyogi aims to solve the problem of used bikes' hunting by bringing credibility to online used bikes discovery. All inspected used bikes listed on the platform come with a free 1 year Warranty and the verified seller details are shared with the prospective buyer for direct price negotiations and meeting.



Rideyogi launched in September’2015, currently caters to Delhi NCR and aims to be present in the top two-wheeler density markets in India by the end of 2016.

About Rideyogi.com:

Rideyogi.com is a property of PBS Technologies Pvt Ltd, founded by Ex-Airtel & Hero Motorcycles executives. The team at PBS Technologies is led by Ankit Sakhuja, who served as a young-leader at Airtel for 3 years before starting-up Rideyogi with Leo Paul (Over 15 years of experience in R&D with Hero Motorcycles & Maruti), Arjun Bhasin (an IIT Kanpur Alum with 2 years of experience with Hero Motorcycles) and Gaurav Arora (Pursuing CSE at PEC, Chandigarh & Interned with Amazon).

Website URL: http://www.rideyogi.com"
"December 06, 2015 06:23 PM IST",https://www.moneycontrol.com/news/business/companies/shemaroo-partners-dth-players-to-launch-miniplex-1490313.html,"live bse live

nse live Volume Todays L/H More ×

Film content and entertainment business provider Shemaroo Entertainment plans to launch its movie premiere service 'Miniplex' on cable and online after partnering with two DTH players.Shemaroo last month tied up with direct-to-home operators (DTH) Airtel and Tata Sky to launch Miniplex and the company said it will also look at tying up with other DTH players.""DTH has now emerged as a large subscription platform. So we started initially with Airtel and then with Tata Sky, and over a period, we will make this service available to many platforms as possible, where the paid subscriber base has some scale,"" Shemaroo Entertainment Director Hiren Gada told PTI.He added that the expansion would happen in a phased manner and it would take about three to four quarters to have a wider base.""By next December we should be present on many more platforms. There are four other (DTH) players. There are cable operators, particularly in the phase I, phase II markets where the digitisation has already taken place or the cities where the process is taking place, so that is another set of people that we are looking to work with,"" he said.The company would be focusing on multi-system operators (MSOs) first as they have scale in terms of numbers and have technology back-end to support a paid platform.He further said they are considering a digital platform distribution that the Miniplex content can go through, on a paid basis.Miniplex is an ad-free movie service, where the company will premiere one movie every Friday, besides showing curated movies through the week.Miniplex will predominantly showcase Hindi movies but the company will look at some cherry-picked regional content as well, going forward.""The current thought process for Miniplex is that it is a Hindi movie service. But if some really brilliant regional cinema comes -- which has a wider appeal, which has an international acclaim or National award winners or India's entry to Oscars -- those kind of movies we feel may fit into the proposition or the kind of audience we are looking at,"" he said. ."
"December 02, 2015 06:23 PM IST",https://www.moneycontrol.com/news/business/economy/it-cos-invoke-alternate-plans-as-rain-hits-chennai-ops-1499955.html,"Heavy downpour have hit operations of IT companies in Chennai -- one of the leading IT destination in the country, but the firms say that they have invoked alternative measures to ensure there is no impact on critical services. Most of the offices in the city, including that of IT companies, remained closed today due to heavy rains with leading Indian firm Infosys deciding to remain closed tomorrow as well due to flooding at its premise. ""In light of the rains and flooding in Chennai, Infosys campuses in the city were closed on December 2 and we have also declared a holiday on December 3. Our teams in Chennai have been working with local authorities to get employees stranded across the city to return home safely,"" Infosys spokesperson said. Infosys said that flooding at its both campuses is under control and the water levels have started receding. ""Our business continuity plans have been activated and we have taken necessary actions to ensure client commitments are met, which includes managing work from other locations,"" the spokesperson said.

Cognizant which has its largest office in Chennai with 60,000 people across 11 facilities in the city said that some of its employees have stayed back in office to support critical services while some have travelled to other cities to support operations. ""In view of the situation resulting from incessant rains in Chennai and the meteorological department's forecast of heavy rains, Cognizant offices in Chennai are closed today, December 2. However, there is no disruption to work on critical projects and 24x7 operations support,"" Cognizant spokesperson said in response to an email query.

The company said that it has invoked business continuity plan and employees have stayed back at its facilities for aiding projects that require round the clock support. It added, all arrangements have been made for the staff including food and accommodation, both in its campuses as well as nearby hotels. ""We are providing all possible transportation support to our employees in Chennai and have advised them to take utmost safety precautions. Some of our employees have already travelled to Cognizant centres in other cities to provide support to our clients,"" it said. IT major Tata Consultancy Services said that its offices in Chennai are also shut today and ""the strong business continuity plans ensure that there is no impact on business."" The company said that all its employee are safe and there is no water logging in any of its offices. Airtel said that its services have also been partially disrupted due to power failure and the company is working with local authorities to restore them.

""We at Airtel are relentlessly working with the local authorities to enable smooth mobile communication for Airtel customers across the city,"" the company said."
"November 09, 2015 06:51 PM IST",https://www.moneycontrol.com/news/business/companies/apple-takes-lions-share4g-handset-marketindia-1449803.html,"live bse live

nse live Volume Todays L/H More ×

American tech giant Apple has the biggest share of the total 14.8 million 4G-enabled devices active across all important frequencies in the country, says a study by Nokia Networks. Among the top 15 4G models, Apple devices - iPhone and iPad - occupy the top two slots. iPhone 5S and iPhone 6 devices, which support 4G services in 1800 Mhz band, are top models with 10.46 percent and 8.9 percent shares respectively, as per the study.

In India, Airtel is providing 4G service in 1800 Mhz band frequency while other companies are yet to roll out their services. At present, telecom companies hold spectrum in 1800 Mhz band, 850 Mhz band, 2300 Mhz band that can be used for 4G services in India. As per the study, Nokia Networks sees potential for providing using 2100 Mhz band for 4G services which is at present being used for 3G services.

""LTE (4G) device penetration is still low at 1.61 percent. 1800 Mhz enabled LTE devices leads with 1.45 percent (13.3 million) followed by 2100 Mhz enabled devices at 1.2 percent,"" the report said. Airtel has highest number of circles with 3G spectrum.

The study shows that the number of 4G enabled devices in 2100 Mhz or 3G band connected to network is more compared to number of devices available for 4G service in 2300 Mhz band -- the band opted by Reliance Jio Infocomm to foray into the telecom business. iPhone 5S, iPhone 6 models have highest share of 18.12 percent and 15.42 percent respectively among connected devices that can support 4G services 850 Mhz band, says the study. Reliance Communications and RJIL are planning to jointly roll out 4G services using 850 Mhz band spectrum.

Though Apple leads the segment of active 4G devices, the study also found that six out of top 10 devices in 1800 Mhz are priced below Rs 8,000. Lenovo A6000 follows iPhones among connected devices in 1800 Mhz band with 7.5 percent share. It is again followed by Apple's iPhone 5 which has 5.78 percent share.

Xiaomi's RedmiNote 3 and Micromax Yu Yureka are at 5th and 6th spot among devices in 1800 Mhz band, as per the study. Samsung Galaxy A5 follows iPhones at 4th spot among top 15 devices capable of supporting 4G services. Nokia Networks spokesperson clarified that the data is not about shipment or sale of devices but only about devices that are active on networks and the kind of service that they can support."
"September 23, 2015 10:34 PM IST",https://www.moneycontrol.com/news/business/companies/paytm-plans-to-launch-payments-bank-by-march-1504325.html,"Mobile payments and commerce company Paytm founder and CEO Vijay Shekhar Sharma, who received in-principle nod from the RBI to set up a payments bank, is planning to start the bank this fiscal year itself. ""We would like to be first off the block. We are targeting to launch this financial year itself,"" Paytm Chief Financial Officer and Vice President for Business and People Amit Sinha told reporters here today.

Sharma was one of the two individuals, besides nine other entities including Reliance, Vodafone, Airtel, Birla and TechMahindra, among others, which have been granted in-principle nod to set up payments banks by Reserve Bank last month. Sinha said his company is open for partnership with banks, NBFCs or insurance companies, but it would be in mainly for product development. ""We are talking with people. We would be bringing in our user-insights on how we want to have the product. With this partnership we will be leveraging more of their product expertise,"" he said. It is also in the process of appointing a consultant who would help in getting a partner.

Sinha said Paytm has enough funds which would be needed for setting up a payments bank. ""It is a need-based thing. We are always on the lookout because of the kind of business growth that we are seeing.

But for now we are good to go,"" he added."
