Date,link,text
"August 23, 2021 03:55 PM IST",https://www.moneycontrol.com/news/business/vodafone-idea-loses-42-8-lakh-mobile-users-in-june-airtel-jio-add-subscribers-7375851.html,"Troubled Vodafone Idea continued to lose mobile subscribers in June, ceding fresh ground to rivals Reliance Jio and Bharti Airtel which added 54.6 lakh and 38.1 lakh customers, respectively, in the fiercely-competitive Indian telecom market, according to monthly data by TRAI.

Vodafone Idea lost about 42.8 lakh subscribers during June, as its user base shrunk to 27.3 crore, compounding the woes of the debt-laden telco which is struggling to stay afloat.

According to telecom subscription data for the month of June released by sector regulator TRAI, Reliance Jio cemented it lead, gaining 54.6 lakh users. Its mobile subscriber base swelled to 43.6 crore in June.

The Mukesh Ambani led telecom operator also led the tally of subscriber net additions in wireline, onboarding 1.87 lakh new users in that category.

Bharti Airtel added 38.1 lakh wireless subscribers in June, pushing up its mobile user base to 35.2 crore.

Overall, the number of telephone subscribers in India increased to 120.2 crore at the end of June 2021, a monthly growth rate of 0.34 per cent.

Urban telephone subscription was up, but the rural subscriptions dipped marginally in June.

""As per the reports received from 440 operators in the month of June, 2021, the number of broadband subscribers increased from 780.27 million (about 78 crore) at the end of May-21 to 792.78 million (about 79.2 crore) at the end of June-21 with a monthly growth rate of 1.60 per cent,"" the data by Telecom Regulatory Authority of India (TRAI) showed.

The top five service providers constituted 98.7 per cent market share of the total broadband subscribers at the end of June.

""These service providers were Reliance Jio Infocomm Ltd (439.91 million), Bharti Airtel (197.10 million), Vodafone Idea (121.42 million), BSNL (22.69 million) and Atria Convergence (1.91 million),"" TRAI said.

TRAI''s subscriber count score card for June, comes amid an existential struggle of mobile operator Vodafone Idea in a three private player market.

Billionaire Kumar Mangalam Birla recently stepped down as chairman of Vodafone Idea Ltd, within two months of offering to hand over Aditya Birla Group''s stake in the telco over to the government, in a bid to avert a crisis for the telecom company.

As per the Q1 report card released by the telco, the total gross debt (excluding lease liabilities and including interest accrued but not due) as of June 30, 2021 of VIL stood at Rs 1,91,590 crore, comprising of deferred spectrum payment obligations of Rs 1,06,010 crore and adjusted gross revenue (AGR) liability of Rs 62,180 crore that are due to the government."
"August 13, 2021 01:58 PM IST",https://www.moneycontrol.com/news/telecom/airtel-jio-conclude-spectrum-trading-agreement-7331141.html,"The Department of Telecommunications (DoT) had on April 16 completed assigning spectrum to telecom operators who bought airwaves for 4G wireless service in the Spectrum Auction, 2021, conducted on March 1 and 2. (Source: Reuters)

Bharti Airtel, on August 13, announced the closure of the agreement with Reliance Jio to transfer the ‘Right to Use’ of Airtel’s 800 MHz spectrum in three circles to Jio.

""Airtel has received Rs. 1004.8 crores (net of tax) from Jio for the proposed transfer. In addition, Jio will assume future liabilities of Rs. 469.3 crores relating to the spectrum,"" Airtel said in a press release.

With this trading, Jio will have 2X15MHz of spectrum in the 800MHz band in the Mumbai circle and 2X10MHz of spectrum in the 800MHz band in Andhra Pradesh and Delhi, thereby further consolidating its spectrum footprint in these circles.

""With the enhanced spectrum footprint, especially contiguous spectrum, and superior infrastructure deployed, RJIL has further increased its network capacity,"" Reliance Industries Limited had earlier said.

Bharti Airtel touched a 52-week high of Rs 638.60 and was quoting at Rs 634.05, up Rs 10.80, or 1.73 percent on the BSE.

The Department of Telecommunications (DoT) had on April 16 completed assigning spectrum to telecom operators who bought airwaves for 4G wireless service in the Spectrum Auction, 2021, conducted on March 1 and 2.

During the bidding, Reliance Jio emerged as the top bidder, which bought spectrum worth Rs 57,122.65 crore in the first spectrum auction in more than four years. Airtel purchased spectrum worth Rs 18,698.75 crore.

Disclaimer: Reliance Industries Ltd. is the sole beneficiary of Independent Media Trust which controls Network18 Media & Investments Ltd which publishes Moneycontrol."
"August 04, 2021 09:51 AM IST",https://www.moneycontrol.com/news/business/moneycontrol-research/airtel-continues-to-benefit-from-the-pandemic-7273871.html,"(Source: Reuters)

PRO Only Highlights

- Quarterly performance largely backed by improved realisations

- Medium-term triggers China plus and protectionist measures for tyre industry

- Valuations not inexpensive; but improved medium-term outlook

Like last year, Bharti Airtel (CMP: Rs 578.35, Mcap: Rs3,19,000 crore) continues to do well in this fiscal too amid the pandemic. The severe second wave of Covid-19 notwithstanding, the telecom company’s performance vectors, during the first quarter (Q1FY22), have moved north, aided by factors such as work from home, streaming of more entertainment content online, home schooling etc. Not only did the performance improve on a year-on-year (YoY) basis but it was also better sequentially. Quarterly result highlights (image)..."
"July 28, 2021 02:31 PM IST",https://www.moneycontrol.com/news/business/airtel-discontinues-rs-49-prepaid-recharge-raises-entry-level-pricing-7239391.html,"(Source: Reuters)

With a focus on improving realisation, Airtel on Wednesday announced revisions to its prepaid plans, raising its entry-level pricing by nearly 60 per cent.

The telecom operator said it has discontinued its Rs 49 entry level prepaid recharge. The company's prepaid packs would now start from the Rs 79 smart recharge and offer up to four times more outgoing minutes of usage to customers along with double data, Airtel said in a statement.

""This change is in line with the company's focus on offering superior connectivity solutions. Airtel customers on entry level recharges can now stay connected for longer without worrying about their account balance,"" Airtel said.

The revision is effective from July 29, 2021.

The Rs 79 plan packs-in Rs 64 talk time, and 200 MB data, with validity of 28 days.

The latest move is significant as telecom operators are focusing on raising average revenue per user (ARPUs).

Last week, Airtel had upgraded its postpaid plans, while earlier this week, the enterprise arm of Vodafone Idea (VIL), Vi Business, announced a range of new postpaid plans for corporate customers saying upgraded plans would be bundled with various benefits."
"July 12, 2021 06:52 PM IST",https://www.moneycontrol.com/news/telecom/airtel-records-over-1000-mbps-speed-during-5g-trial-with-nokia-in-mumbai-7161141.html,"Telecom operator Bharti Airtel recorded a speed of over 1 Gigabit per second during a 5G field trial in Mumbai using Finnish firm Nokia’s network gear, according to sources.

The company is running a live 5G trial in Mumbai’s Phoenix Mall in Lower Parel.

When contacted, a Nokia spokesperson confirmed the development.

""Airtel is conducting the trial in the 3500 MHz band using 5G gear from Nokia as per DoT guidelines. The trials have delivered speeds of over 1 Gbps with ultra-low latency,” one of the sources said.

1 Gbps is 1,000 Mbps (Megabits per second).

The Department of Telecommunications (DoT) had recently allotted 5G trial spectrum to Airtel in 3500 MHz, 28 GHz and 700 MHz in Delhi-NCR, Mumbai, Kolkata and Bengaluru to develop India-relevant use cases on the next generation fast wireless broadband technology.

Earlier this year, Airtel became the first telecom operator to test 5G over a live network in Hyderabad using liberalised spectrum in 1800 MHz band.

""Airtel and Nokia plan to soon begin 5G trials in Kolkata,” the source said.

Bharti Airtel has received permission for runnial trials Delhi and Bengaluru as well."
"July 04, 2021 09:11 PM IST",https://www.moneycontrol.com/news/business/telecom-watchdog-wants-govt-to-reject-vi-plea-for-deferring-payments-7123411.html,"Vodafone Idea | Representative image

Vodafone Idea can raise funds through equity sale or promoters can infuse capital which can be used for clearing dues, non-profit entity Telecom Watchdog said in a letter to telecom minister while demanding rejection of the debt-ridden company's request seeking more time to pay dues of Rs 8,292 crore. Vodafone Idea (Vi) has approached the government to seek one-year moratorium on payment of spectrum instalment of over Rs 8,200 crore, due in April 2022.

Vi, in a letter to the telecom secretary on June 25, 2021, said it would be unable to pay the instalment of Rs 8,292 crore due on April 9, 2022 due to cash being used for payment of AGR (Adjusted Gross Revenue) dues and the inability of the operations to generate the required cash in a predatory pricing situation.

ALSO READ: Investors unwilling to put in money unless tariffs rise, industry health improves: Vodafone-Idea writes to DoT

Vi has also said that while it is working on raising new funding for the past six months, investors are not willing to invest in the company because they believe that unless there is a significant improvement in consumer tariffs, the health of the industry will not recover and they will incur a loss on their investment.

Telecom Watchdog in a letter dated July 3 alleged that there is no basis in Vi representation that investment is not coming to India due to lower tariffs and these ""false claims by VIL are made with an ulterior motive to avoid payment of the next instalment of government dues.""

When contacted, a Vi spokesperson said, ""Industry players have pointed out the tremendous stress in the telecom sector. COAI, the industry body representing all three private operators has over the last two years pointed out the need for support to the sector and unanimously asked for Floor pricing to be set for restoring the health of the sector. We would not comment on speculative commentary and ill-informed conclusions.

The non-profit entity said that Vi promoters, Kumar Manglam Birla and Vodafone Group Plc are financially very strong and their reluctance in clearing government dues is not proper. According to the entity, Birla has a personal net worth of Rs 99,000 crores which is almost 50 per cent more than his net worth last year and Vodafone Group Plc's market valuation was Rs 3,40,000 crores as of July 2, 2021.

""Both could have infused funds in the company to ensure timely payment of the government dues. Both have respectable images across the globe and should not have any constraint or difficulty in raising funds apart from improving operational performance of the company,"" the letter said. Promoters of Vi have made public statements that they will not infuse any fresh funds into the company.

Telecom Watchdog alleged that the request of Vi inability to raise funds establish its mismanagement of affairs in terms of operation and financial management. ""It (Vi) has miserably failed to raise funds by dilution of equity and upgrade its networks with latest technology to reduce cost etc,"" the letter said. The entity said the request of Vodafone Idea should not be considered as there cannot be any ""factually incorrect misleading statements than those given by VIL"" on the financial health of the Indian telecom sector.

It said that both Jio and Bharti Airtel have raised funds by diluting their equity which shows that the Indian telecom sector is a bright star and Vodafone Idea request should be rejected as ""there is no basis in VIL representation that investment is not coming to India due to lower tariffs"". Telecom Watchdog said that the government cannot continue to extend benefits just to help and keep afloat one single company which is unable to manage its own affairs.

""It is submitted that this is a fit case for a forensic audit of accounts for the last 10 years at least to examine misrepresentation of facts to lenders or diversion of funds to delay or avoid payment of government dues,"" the letter claimed. Vi has reported narrowing of its consolidated loss to Rs 7,022.8 crore for the quarter ended March 2021, mainly on account of cost optimisation. The company had posted a loss of Rs 11,643.5 crore in the same period a year ago.

Total income declined by about 19 per cent to Rs 9,647.8 crore from Rs 11,920.4 crore in the corresponding quarter of 2019-20. For the year ended March 31, 2021, Vi loss narrowed to Rs 44,233.1 crore from Rs 73,878.1 crore at the end of 2019-20. The gross debt (excluding lease liabilities) on VI as of March 31, 2021 was Rs 1,80,310 crore, comprising of deferred spectrum payment obligations of Rs 96,270 crore and AGR (adjusted gross revenue) liability of Rs 60,960 crore that is due to the government and debt from banks and financial institutions of Rs 23,080 crore."
"June 22, 2021 06:35 PM IST",https://www.moneycontrol.com/news/business/what-does-5g-rollout-implementation-partnership-with-airtel-mean-for-tcs-7071951.html,"(Source: Moneycontrol)

live bse live

nse live Volume Todays L/H More ×

On June 21, Airtel and Tata Group’s IT arm TCS announced partnership for implementation of 5G solutions, starting pilot from January 2022. A move that would help the latter strengthen its capability and scale and the former reduce the cost of the deployment, say analysts.

What does the partnership entail?

TCS will implement the 5G solutions it has developed for Airtel. Tata Group has developed 5G solutions using Open-Radio Access Network (O-RAN), a part of telecommunication architecture. O-RAN is similar to open source in software, that is, it is not proprietary. It can be used by any company to develop solutions hence making it flexible for more companies to develop solutions. Increased participation brings down the cost for 5G implementation.

TCS has developed solution based on O-RAN and will be commercially available on January 2022, when the pilot deployment will begin.

What is in it for TCS?

This partnership is important for TCS, for whom it is a key focus area, as emphasized by its Chairman N Chandrasekaran during the recent annual general meeting (AGM).

During the TCS AGM on June 10, Chandrasekaran, chairman, Tata Group said, “5G is new technology and TCS will play a significant role both in the development of firmware, which is required to develop the necessary technology (for 5G solutions). But most importantly, leveraging the 5G and create large number of applications in various sectors. This is an important growth area for TCS.”

The partnership is clearly in line with this vision, where TCS can strengthen its capabilities and eventually scale its solutions and gain market share when 5G deployment gains pace in India and globally.

Ray Wang, Principal Analyst & Founder, Constellation Research, a research and advisory firm, said that TCS’ O-RAN based solution is a key capability in their telecom stack that will give Airtel a competitive advantage and drive down the cost of 5G deployment in India.

“(With this partnership) TCS also gains the capability to help other telcos with both the technology and implementation and Airtel will save a lot of time and money in the rollout,” Wang added.

A Bengaluru-based analyst explained that 5G implementation has more software component than 4G and hence there is more need for technology service providers. Without partnerships with IT firms, telcos will run into integration challenges, making this partnership important, given the huge opportunity 5G provides.

5G implementation market

An analysis by UBS pegs that 5G rollout is a $30 billion opportunity for Indian IT firms. The market is clearly huge and it is not lost on the IT service providers.

For instance Tech Mahindra has partnered with Japanese telecom major Rakuten for 5G implementation. According to several media reports, Tech Mahindra wants to partner with the telecom major Jio for 5G implementation. Reliance-owned Jio, which is one of the key players in the 5G space, is expected to launch 5G smartphone in partnership with Google this week, according to reports.

Globally too, such partnerships are common place and will likely continue. For instance, Vodafone has partnered with Capgemini for 5G implementation.

But…

Though the opportunity is huge, benefits from these partnerships are unlikely to be significant, point out some.

Peter Bendor-Samuel, CEO, Everest Group, said, “These partnership rarely mean very much and are mostly a signaling vehicle to show that the parties are committed to 5G. That is not to say that TCS will not capture some revenue from this but in the end Airtel will work with other vendors and TCS will work with other 5G networks. So the partnership is good publicity but is unlikely to contribute significantly to either party’s market success.”

Telcos like Airtel, Jio and Vodafone work with major IT service providers, and other players will get a part of the pie too.

In terms of revenues too, it might not amount to a significant value, at least not in the beginning. “This is a new technology and there is a lot of uncertainty between pilot to implementation. So this would be a step by step process,” explained Pareekh Jain, founder, Pareekh Consulting.

Disclaimer: MoneyControl is a part of the Network18 group. Network18 is controlled by Independent Media Trust, of which Reliance Industries is the sole beneficiary."
"March 22, 2021 12:22 PM IST",https://www.moneycontrol.com/news/business/bharti-airtel-directors-panel-approves-preferential-allotment-of-36-4-million-shares-to-lmil-6676031.html,"Source: Reuters

live bse live

nse live Volume Todays L/H More ×

Bharti Airtel on Monday said its special panel of directors has approved allotment of 36.4 million equity shares on a preferential basis to Warburg Pincus affiliate at Rs 600 issue price, as partial consideration towards Bharti Telemedia deal.

As per the contours of the recently-announced deal, Bharti Airtel will acquire a 20 percent stake in its DTH arm Bharti Telemedia from Warburg Pincus affiliate Lion Meadow Investment Ltd for about Rs 3,126 crore.

""...the ''Special Committee of Directors for Fund Raising'' of the company has, at its meeting held today, March 22, 2021, approved the allotment of 3,64,69,913 equity shares of the face value of Rs 5 each fully paid up, on a preferential basis to Lion Meadow Investment Ltd, an affiliate of Warburg Pincus at an issue price of Rs 600 per equity share (including a premium of Rs 595 per equity share)...,"" Airtel said in a regulatory filing.

This is towards ""partial consideration other than in cash against the acquisition of 10,20,40,000 equity shares, constituting 20 percent of the equity share capital of Bharti Telemedia, by the company from Lion Meadow"", it informed.

As a result, Lion Meadow will hold about 0.664 percent of the post-issue equity share capital of the company.

The paid-up equity share capital of the company stands increased to Rs 2,746 crore entailing ""5,49,20,27,268 equity shares of Rs 5 each"".

Airtel had earlier stated that Bharti Telemedia transaction will be discharged primarily via issuance of about 3.64 crore equity shares of Airtel at a price of Rs 600 per share and up to Rs 1,037.8 crore in cash."
"March 12, 2021 09:34 AM IST",https://www.moneycontrol.com/news/business/moneycontrol-research/weekly-tactical-pick-airtel-6636481.html,"(Source: Reuters)

We have chosen Bharti Airtel (CMP: Rs 525, Mcap: Rs 286,000 crore) as our pick for the week as it is among the few to benefit from the Covid-19 pandemic that has caused significant distress across various segments of the economy. Moreover, the stock price has seen a 15 per cent correction from the recent high of Rs 623 hit on February 4, 2021, giving an opportunity to re-enter. There are a couple of factors that have led to the..."
"March 10, 2021 09:11 PM IST",https://www.moneycontrol.com/news/business/5g-spectrum-auction-unlikely-in-fy22-say-experts-6630821.html,"The government managed to receive bids worth Rs 77,814.80 crore in the recently concluded spectrum auction. (Reuters)

Telecom analysts believe that a sharp downward revision by the government in its telecom non-tax receipts for FY22 indicates that 5G spectrum sale in the 3.5 GHz band is unlikely in the next fiscal.

Budget documents released on February 1 show that the government has slashed its budgeted telecom non-tax receipts for FY22 by 60 percent to Rs 53,987 crore. In the previous budget (FY21), the government had set an ambitious revenue target of Rs 1.33 lakh crore, but had later revised it to Rs 33,737 crore.

""We believe 5G spectrum auction is unlikely in FY22. In the recently concluded auction, both Jio as well as Airtel invested large amounts and have increased their 4G coverage as well as capacity spectrum holdings. Over the next few months the companies are likely to focus on putting this spectrum to use and strengthen their 4G networks,"" said Kunal Vora, Senior Telecom Analyst, BNP Paribas.

He added, ""Recently Bharti Airtel has said India will be 5G ready in 2-3 years, and we believe that operators will look to improve 4G monetisation rather than invest in 5G in FY22. The government’s revenue expectations from telecoms is more realistic in FY22 compared to FY21, and we believe it does not include 5G spectrum auction proceeds.""

The government usually earns its non-tax revenue from the telecom operators in the form of licence fees and spectrum usage charges. It also earns its non-tax revenue from the proceeds of spectrum auction AGR payment.

In FY21 ending March 31, 2021, the government is expected to net over Rs 20,000 crore as upfront payment from telcos for the 4G airwaves auction that concluded on March 2.

The government had auctioned airwaves across seven bands worth Rs 3.92 lakh crore and had managed to receive bids for spectrum worth Rs 77,814.80 crore by beating analysts expectations.

Ankit Jain, Vice-President, Corporate Ratings, ICRA noted, ""The non-tax revenue receipts for GoI for FY21 are likely to be higher than the revised estimates. In the event no AGR payments are required to be made by the telcos in the current fiscal, the non-tax receipts are expected to be around Rs 45,000-50,000 crore.""

""This includes a major part of the upfront payment of the recently concluded spectrum auctions to be made by March 31, 2021, with some spillover to FY22 for spectrum which will be available at a later date. For FY22, the estimated non-tax receipts are expected to be around Rs 40,000-45,000 crore in the absence of 5G-spectrum auctions,"" he added.

Differing in view, Isha Chaudhary, Director, CRISIL Research, noted, ""The demand notices for the upfront payment from the recently concluded spectrum auctions were issued soon after the auctions. Thus the proceeds from the same will add to the government’s current year revenues from the telecom sector resulting in revenues surpassing Rs 50,000 crore against revised estimated of Rs 33,737 crore.""

In FY22, the government has budgeted Rs.53,987 crore, of which around Rs 30,000-35,000 crore is expected to be from licence fees, spectrum usage charges and AGR dues instalments. This leaves a balance of around Rs 20,000 crore of revenue from other areas. However, the upfront payment from 5G auctions is likely to garner significantly larger amount and hence if 5G auctions do take place, the government may end up getting higher collections than the budgeted estimate in FY22, she added.

Given the pace of 5G deployments in other major economies and Indian Telcos getting their networks 5G ready, the government is likely to try to schedule the 5G spectrum auctions in the current year itself, Isha concluded.

Disclaimer: Reliance Industries Ltd. is the sole beneficiary of Independent Media Trust which controls Network18 Media & Investments Ltd."
