Date,link,text
"June 20, 2018 02:47 PM IST",https://www.moneycontrol.com/news/business/hdfc-bank-asks-executive-to-dont-engage-customer-further-and-assign-if-ranting-on-twitter-query-2610111.html,"Tellers are seen through a cheque deposit counter at an HDFC bank branch in Mumbai November 17, 2012. At a time when lenders across the world are battling slowing growth and rising loan defaults, HDFC Bank's conservative business model and its knack for delivering returns are proving unique, and offer a lesson for its hard-pressed competitors. REUTERS/Vivek Prakash (INDIA - Tags: BUSINESS) - RTR3AKV3

live bse live

nse live Volume Todays L/H More ×

In recent days, careless social media handling has put many bigwigs of the Indian corporate industry in a tight spot. Airtel on Monday, by their own admission, inadvertently, acceded to the demands of a customer who sought a Hindu representative instead of a Muslim which was ridiculed by a vast majority of people on social media.

It seems, before Airtel erred, HDFC Bank had also mishandled a customer on Twitter. A customer who asked the bank about its policy of making Aadhaar mandatory for opening bank accounts, the company apparently instructed its executive to “do not engage the customer further” and assign if “ranting” continues.

The bank, however, deleted the tweet and apologised later. The bank admitted that the earlier tweet was “inappropriate and inadvertent.”

Bharat Varma, who goes by the Twitter handle @BharatVarma3, in a tweet on June 15, demanded clarification from the bank:

Simple query. Need to open a new savings account. Willing to submit all documents offline. Your website does NOT say Aadhaar is mandatory. It's mentioned as just one ID proof. IS AADHAAR MANDATORY?

HDFC Bank apparently replied, “Hi Bharat, yes, as per our Bank’s internal guidelines, Aadhaar Card or Aadhaar enrolment number is required at the time of opening a account. (Sic)”

In the same tweet by the bank, signed by someone named Anay, an instruction to the 'NS team' was passed, “Post response and do not engage customer further. If ranting, assign.”



Is this your official policy with respect to forcing aadhaar ILLEGALLY on your customers? ""NS Team: Post response and do not engage customer further. If ranting, assign. -Anay"" pic.twitter.com/oIxaWLg2lO

— Bharat Varma (@BharatVarma3) June 18, 2018

The tweet was later deleted, and only a screenshot was posted by Bharat Varma later. Moneycontrol has not seen the tweet.

HDFC Bank, in the same thread, posted another response, “A tweet posted in response to a customer's query earlier was inappropriate and inadvertent. It's a human error which shouldn't have happened. This doesn't reflect the Bank's commitment towards excellent service. We are extremely sorry and sincerely regret this error.”



A tweet posted in response to a customer's query earlier was inappropriate and inadvertent. It's a human error which shouldn't have happened. This doesn't reflect the Bank's commitment towards excellent service. We are extremely sorry and sincerely regret this error.

— HDFC Bank (@HDFCBank_Cares) June 15, 2018

As per Reserve Bank of India’s rules on KYC, Aadhaar is key to open a full-fledged bank account. However, even without Aadhaar, banks can open a ‘small account’ which have severe restrictions on transactions and are closely monitored to ensure no foreign transactions take place.

Moreover, any change in norms, however, was subject to a final decision by the Supreme Court on matters related to Aadhaar, the banking regulator had clarified. The changes made in circular were not supposed to have an immediate impact.

The hearing on the validity of Aadhaar and its use for linking to various financial schemes and banks has been completed and the judgment is awaited in the Supreme Court."
"June 20, 2018 12:33 PM IST",https://www.moneycontrol.com/news/trends/current-affairs-trends/omar-abdullah-slams-trolls-sending-hate-tweets-to-airtel-user-who-sought-a-hindu-representative-2609381.html,"While the Twitterati was busy trolling Pooja Singh, the Airtel customer who refused to be attended to by a Muslim customer service representative, Mr Omar Abdullah, the former Chief Minister of Jammu and Kashmir, has slammed the trolls and called them as bigoted as Pooja.

In his tweet, he said: ‘I hold no brief for the bigoted Airtel customer but those of you flooding her timeline with hate & abuse are as bad, if not worse, than her. If you can’t occupy the high ground it’s best to exit the ground altogether.’



I hold no brief for the bigoted Airtel customer but those of you flooding her timeline with hate & abuse are as bad, if not worse, than her. If you can’t occupy the high ground it’s best to exit the ground altogether.

— Omar Abdullah (@OmarAbdullah) June 19, 2018

In a drama that unfolded in the last 48 hours, Pooja Singh, an Airtel customer had tweeted her refusal to talk to a customer service representative because he was a Muslim.

While Airtel immediately assigned another representative to solve her complaint, the Twitterati lashed out at her with misogynist comments and insults.

Many noted celebrities and politicians responded to Mr Abdullah’s tweet.

Amid all this, Pooja Singh posted another tweet that spoke about the abuse she has been receiving for his previous tweet but it seems it did not solve the matter."
"June 14, 2018 09:52 AM IST",https://www.moneycontrol.com/news/business/rcom-group-head-count-falls-94-to-3400-people-2589999.html,"Reliance Communications | In the last four months, the stock price has risen 487 percent to Rs 3.93 per share from Rs 0.67 per share on March 27, 2020.

Debt-ridden Reliance Communications said the number of employees have come down by over 48,000 to the current level of 3,400 people.

This is a reduction of a whopping 94 percent from the peak level of around 52,000 employees.

""Total number of people in the RCom group: from peak of approximately 52,000 to current 3,400, a reduction of approximately 94 percent,"" RCom said in a BSE filing.

The company was estimated to be at its peak around 2008-10.

RCom, which is reeling under debt of around Rs 45,000 crore, closed it mobile services business in January this year and continues to provide business-to-business (B2B) telecom services.

The company in the filing said that its B2B unit is insulated from ongoing tariff war in the industry.

""The tariff wars between the incumbents -- Airtel, Idea, Vodafone and the new entrant Reliance Jio continue unabated, further dragging down all key financial metrics of the wireless sector. However, post its wireless B2C business exit on January 2018, RCom is no longer affected by the severe and prolonged wireless sector hyper competition,"" the filing said.

RCom said it is evident from the latest sector revenue report released by the Telecom Regulatory Authority of India that the wireless sector continues to be on a downward spiral, with over 21 per cent revenue decline on an year-on-year basis.

Overall revenue market size shrunk by over Rs 26,000 crore on annualised basis, it added.

""RCom operational business fully insulated from the hyper competition, mega capex requirements, financial stress of the wireless sector,"" the filing said."
"May 20, 2018 07:36 PM IST",https://www.moneycontrol.com/news/business/dot-seeks-reply-from-airtel-on-apple-watch-esim-service-by-may-24-2571937.html,"live bse live

nse live Volume Todays L/H More ×

The DoT has sought reply within a week from Airtel on a complaint by rival Reliance Jio alleging that the operator flouted norms on activation of eSIM in Apple Watch 3, an official source said.

The Department of Telecom also mentioned that the security clearance tests for the service are due on May 23 and May 30, 2018.

The DoT on May 17 has sought multiple clarification within a week from Airtel about eSIM service facilitation by the company on Apple Watch 3.

Both, Reliance Jio and Bharti Airtel are selling Apple Watch Series 3 since May 11 through their sales channels.

""Jio has filed complaint alleging that Airtel has not set-up the eSIM provisioning node within India in ""gross violation to the licence terms. Airtel had informed DoT about the service but in its letter services storing user information was not indicated. The department has asked Airtel whether e-sim provisioning network of node of Airtel is storing eSIM profiles and user information outside India,"" the source told PTI.

Apple Watch 3 and iPhone of a subscriber share the same number and subscribers can use both iPhone and Apple Watch with eSIM to make or receive calls independent of the call status of the other devices.

The eSIM is paired with the SIM in iPhone wirelessly through a dedicated network node. The node used for eSIM profile allocation contains network and user information such as operator identifier, SIM details, PIN, remote file management for managing SIM files remotely etc.

""The DoT has received information that Airtel intends to launch Apple Watch 3 service. The tests for security clearance of the service is scheduled for May 23 and May 30, 2018. This was informed to Airtel on May 11,"" the source said.

When contacted Airtel spokesperson said that the company has already written to the DoT on May 15, 2018 and clarified that it is in compliance with the licence conditions and why ""Reliance's complaint is fallacious and needs to be rejected"".

""It appears that this particular communication from the DoT (which is dated May 17, 2018) has not taken into account our communication. We would like to reiterate that this is yet another frivolous complaint by Reliance and we will respond to it at the appropriate forums,"" the spokesperson said.

Airtel in its letter dated May 15 to DoT said that all information relating to customers, network nodes etc, along with provision for lawful interception, are hosted in a fully secure manner by the company in India.

It stated that no network node or information or data, as alleged by Reliance Jio, has been hosted outside of India.

Airtel's letter said that network node referred by Reliance Jio appears to be an inventory server, called SMDP server of eSIM, which is not the network node of the company.

The letter said that network related information on SIM or eSIM to enable mobile devices connect with network is loaded by SIM makers outside India.

Airtel said that Reliance Jio itself is using SMDP servers installed outside India, which it has not diclosed to the DoT.

A company official on condition of anonymity said that charges levelled by the rival are baseless and the SMDP server used by Jio is located inside India.

Disclaimer: Reliance Industries Ltd. is the sole beneficiary of Independent Media Trust which controls Network18 Media & Investments Ltd."
"May 16, 2018 09:12 PM IST",https://www.moneycontrol.com/news/business/airtel-to-lay-off-section-of-telenor-staff-post-merger-2570029.html,"A day after government approved its merger with telecom major Airtel, a section of Telenor India's employees are facing lay-off.

They got mails from Bharti Airtel asking them to attend a meeting with the HR officials to discuss ""way ahead and next step"", an employee working for the Norwegian telecom company's Indian subsidiary in Andhra Pradesh circle said.

Confirming the move, Airtel said ""not all people from Telenor India will find meaningful roles within Airtel"".

The Department of Telecom on May 14 approved the merger -- a move that will make the subscriber base of Sunil Mittal-led firm almost twice the size of new entrant Reliance Jio. Both the companies had entered into an agreement for the deal in February 2017.

A Telenor employee said he attended a meeting with HR officials of Airtel after receipt of a mail yesterday.

""They told me that post merger, they have no place for my position. They offered me five months salary and asked my resignation letter. I have not decided what to do, the employee told PTI on condition of anonymity. An Airtel source said Telenor India has around 1,400 employees and 700 of them had been absorbed. Airtel offered ""good financial"" package besides continuance of medical insurance and free calls to the dropouts, the source said.

A spokesperson of Airtel said the company has already ""on-boarded over 700 people from Telenor India and provided them growth opportunities"" across its (Airtels) India and international operations. ""Its inevitable that in a post-integration scenario such as this, not all people from Telenor India will find meaningful roles within Airtel.

""We are ensuring that these people get appropriate support such as continued financial and medical allowances along with the assistance of our placement partners, the spokesperson said in an email reply.

The mail received by Telenor employees said ""You must be aware that Telenor (India) Communications Private Limited has been integrated with Bharti Airtel Ltd. With regards to this legal merger, we invite you for a personal discussion with the Airtel Team to inform you about way ahead and next steps.

Be available for the meeting as per the details below."" Telenor India runs operations in seven circles -- Andhra Pradesh (and Telangana), Bihar, Maharashtra, Gujarat, Uttar Pradesh (East), UP (West) and Assam. PTI GDK VS VS ."
"May 10, 2018 08:18 PM IST",https://www.moneycontrol.com/news/india/hc-modifies-interim-order-asking-airtel-to-change-disclaimer-of-its-ipl-commercials-2566457.html,"The Delhi High Court today modified its single judge's interim orders asking Bharti Airtel to make changes to its advertisements offering ""live and free access"" to IPL coverage by carrying a disclaimer of a larger font size in a prominent and visible place.

A bench of Acting Chief Justice Gita Mittal and Justice C Hari Shankar while passing the order also questioned the maintainability of the suit filed by Reliance JIO (RJIO) which alleged that Airtel's advertisement was ""deceptive and misleading"".

""Prima facie we have strong reservations about the maintainability of the plea,"" the court said while setting aside the second interim order passed by the single judge on May 2.

The single judge in his May 2 order had asked Airtel to use font of 12 pixels in print media and that too in a prominent and visible place and not at the bottom.

The high court, however, allowed the first interim order of April 13 to continue to operate.

In the April 13 order, the single judge had asked Airtel to carry a disclaimer in bold stating that under its 'live and free access offer' only subscription to video streaming platform Hotstar would be free and data charges according to the subscriber's plan would apply.

During the arguments, senior advocates Abhishek Manu Singhvi and Dayan Krishnan, appearing for RJIO, said that both orders were passed with the consent of the two sides and thus, an appeal could not have been moved against the same.

Senior advocate P Chidambaram, appearing for Airtel, contended that while his client was agreeable to carrying a disclaimer of font size 12 pixels instead of the earlier 10 pixels, it was not in agreement with the additional directions that the same has to be carried in a ""prominent and visible place"".

The May 2 order had said, ""So far as the video clips/television advertisements are concerned the disclaimer should start running from the word the girl says 'Seasonal Pass-------------' and it should be displayed in sync with the voice over. The disclaimer in bill boards and hoardings be also at prominent place.""

During the hearing of the appeal by Airtel, the bench said it has ""grave doubts"" about maintainability of the suit by the RJIO.

The RJIO, in its suit, had claimed that the advertisements ""falsely proclaim"" that Airtel was offering ""live and free"" access to T20 cricket coverage and also ""falsely represent that a subscriber need only obtain a 4G sim from the defendant company and download the Airtel TV app to obtain a virtual season pass, that is live and free access to T20 coverage"".

Reliance Industries Ltd. is the sole beneficiary of Independent Media Trust which controls Network18 Media & Investments Ltd."
"May 10, 2018 04:09 PM IST",https://www.moneycontrol.com/news/business/dot-says-bharti-telenor-deal-clearance-in-a-mth-sees-voda-idea-merger-nod-before-june-2566259.html,"live bse live

nse live Volume Todays L/H More ×

The telecom department today assured that the Airtel-Telenor deal will be approved in less than a month and asserted that clearances related to the mega merger of Vodafone and Idea Cellular too are being expedited.

Telecom Secretary Aruna Sundararajan said she did not foresee any hurdles in the clearances pertaining to the Vodafone-Idea merger (a move that would create India's largest telecom operator dislodging Bharti Airtel from the top slot) and that it ""should get done"" in the timeframe of June outlined by the two companies.

Yesterday, the Supreme Court had dismissed the Department of Telecom (DoT) plea that challenged telecom tribunal order directing it to clear Airtel's takeover of Telenor India, without insisting on bank guarantee of about Rs 1,500 crore as a pre-requisite. The move is widely perceived to have positive implications for a takeover deals in the rapidly consolidating telecom market in India.

""Very shortly. (It will take) normal processing time and it will be done,"" Sundararajan said responding to a question on when the approvals from the DoT can be expected in Bharti-Telenor deal. She said the approval will come ""must faster"" than a month.

On whether the same applicability (bank guarantee) should also be expected for Vodafone-Idea merger, the telecom secretary declined to make a specific comment, merely saying that each case will have to be seen separately.

""The Department of Industrial Policy and Promotion (DIPP) and the ministry are working closely to ensure we don't create any bottlenecks and we go through the due diligence and expedite the clearances....at the same time, we are working with the company to ensure there are no delays from our side,"" she said on the sidelines of CII Broadband Summit here.

Last month, during its results announcement, Idea Cellular had said that merger of Idea and Vodafone India is in the final leg of regulatory approvals and expected to be completed by June.

Sundararajan today said that she does not anticipate any issues and that it ""should get done in that timeframe"".

Commerce and Industry Minister Suresh Prabhu has told PTI in an interview earlier this month that the telecom ministry is the competent authority to take the final call on Idea Cellular's proposal for infusing 100 per cent foreign direct investment (FDI) in the company. It was communicated to the DoT that it is the competent authority to deal with the proposal, Prabhu had said.

The FDI policy allows an overseas firm to buy up to 49 per cent stake in an Indian telecom company under automatic approval route. But the government nod is required for stake above 49 per cent.

Idea and Vodafone announced last year that they would combine their operations to create the country's largest telecom operator worth over USD 23 billion, with a 35 per cent market share.

Foreign shareholding in Idea as on March 31, 2018 stood at around 34 per cent, including 7.49 per cent in promoter group and the rest as public shareholders.

British telecom multinational Vodafone Group plc is a majority shareholder in Vodafone India. Foreign shareholding in the combined Idea-Vodafone entity, therefore, would breach the automatic approval limit of 49 per cent.

According to the Idea-Voda merger announcement, Vodafone would own 45.1 per cent of the combined company after transferring a 4.9 per cent stake to Aditya Birla Group for Rs 3,900 crore in cash, concurrent with completion of the merger."
"May 09, 2018 12:23 PM IST",https://www.moneycontrol.com/news/business/market-update-psu-banks-drag-as-sbi-pnb-shed-1-jubilant-food-most-active-tata-motors-jumps-3-2565325.html,"The Indian equity market was trading on a flat to positive note on Wednesday afternoon with the Nifty adding 6 points and was trading at 10,724 while the Sensex was up 46 points or 0.13 percent.

The Nifty IT index outperformed, adding close to 1 percent led by Tech Mahindra which added 1 percent followed by Oracle Financial Services and Tata Consultancy Services.

Nifty PSU bank was however down over 1 percent dragged by State Bank of India and Punjab National Bank which shed 1 percent each while Bank of India, Canara Bank and Union Bank of India were the other losers.

From the auto space, Tata Motors jumped 3 percent as company's wholly owned subsidiary Jaguar Land Rover (UK) has posted robust sales numbers in April 2018. Jaguar Land Rover reported total retail sales of 45,180 vehicles in April 2018, up 11.9 percent year-on-year.

The top Nifty gainers apart from Tata Motors included Titan Company and Bharti Infratel which added 1.5 percent followed by Bharti Airtel and Asian Paints.

The most active Nifty stocks included PC Jeweller which added 1 percent. Jubilant Foodworks, Tata Motors, HEG and ICICI Bank were the other active stocks.

The top Nifty losers were BPCL which shed over 2 percent while UltraTech, Cement, HPCL and Indian Oil Corporation and State Bank of India were the other losers.

The top BSE gainers included Sintex Industries which zoomed 10 percent followed by Linde India which jumped 6 percent. Mahindra Holidays & Resorts, Firstsource Solutions and PNB Housing Finance were the other gainers.

The top BSE losers included names like TIME Technoplast which shed 7 percent while Greaves Cotton and Dalmia Bharat were down 3 percent each. Welspun Corp and GRUH Finance were the other losers.

Firstsource, KPIT Tech, Bombay Dyeing, Divis Labs, Manappuram Finance and Relaxo Footwears were few of the stocks that hit fresh 52-week high in the afternoon trade.

On the other hand, 60 stocks hit new 52-week low including names like Alok Industries, Chennai Petro, EROS International, HUDCO, NBCC, MRPL and Vakrangee among others.

The market breadth was in favour of the declines with 778 stocks advancing while 864 declined and 400 remained unchanged. On the other hand, in the BSE, 1151 stocks advanced and 1267 declined and 113 remained unchanged."
